mid,original_title,homepage,overview,popularity,production_countries,release_date,revenue,runtime,spoken_languages,vote_average,vote_count,genres_1,genres_2,genres_3,keywords_1,keywords_2,keywords_3
956,Pete's Dragon,http://movies.disney.com/petes-dragon-2016,"Pete is a mysterious 10-year-old with no family and no home who claims to live in the woods with a giant, green dragon named Elliott. With the help of Natalie, an 11-year-old girl whose father Jack owns the local lumber mill, forest ranger Grace sets out to determine where Pete came from, where he belongs, and the truth about this dragon.",31.974359,United States of America,2016-08-10,143695338,102.0,English,6.2,679,Adventure,Family,Fantasy,feral child,remake,dragon
974,Teacher's Pet,,"Spot (Lane) is a dog who can talk and read. Posing as a human, he sneaks into school with his master Leonard (Flemming). Educational adventures ensue",1.374409,United States of America,2004-01-16,0,74.0,English,5.5,2,Animation,Drama,Family,,,
975,The Straight Story,,"""The Straight Story"" chronicles a trip made by 73-year-old Alvin Straight from Laurens, Iowa, to Mt. Zion, Wisconsin, in 1994 while riding a lawn mower. The man undertook his strange journey to mend his relationship with his ill, estranged, 75-year-old brother Lyle.",15.280261,United States of America,1999-10-15,0,112.0,English,7.7,306,Drama,,,brother brother relationship,mississippi,wisconsin
1010,The Muppet Movie,,"Kermit the Frog is persuaded by agent Dom DeLuise to pursue a career in Hollywood. Along the way, Kermit picks up Fozzie Bear, Miss Piggy, Gonzo, and a motley crew of other Muppets with similar aspirations. Meanwhile, Kermit must elude the grasp of a frog-leg restaurant magnate.",10.639916,United States of America,1979-05-31,76657000,97.0,English,7.0,164,Adventure,Comedy,Family,chicken,musical,frog
1012,The Sound of Music,,Film adaptation of a classic Rodgers and Hammerstein musical based on a nun who becomes a governess for an Austrian family.,37.960289,United States of America,1965-03-02,286214286,174.0,English,7.4,941,Drama,Family,Music,resistance,austria,world war ii
1013,Splash,,"A successful businessman falls in love with the girl of his dreams. There's one big complication though; he's fallen hook, line and sinker for a mermaid.",21.735068,United States of America,1984-03-09,69821334,111.0,English,6.1,321,Comedy,Fantasy,Romance,bachelor,mermaid,
1022,Prom,http://disney.go.com/disneypictures/prom/index.html#home,"At “Prom,” every couple has a story and no two are exactly alike. As the big dance approaches for Nova Prescott, it’s a battle of wills as she finds herself drawn to the guy who gets in the way of her perfect prom. Fellow seniors Mei and Tyler harbor secrets, while others face all the insecurity and anticipation that surrounds one of high school’s most seminal events.",11.837067,United States of America,2011-04-29,10130000,104.0,English,5.7,134,Comedy,,,single parent,waitress,fountain
1051,High School Musical 2,http://www.disneychannel.com/highschoolmusical2,"The East High Wildcats are ready to have the time of their lives. Troy (Zac Efron) is thrilled when he’s offered a job in a country club, but it’s all part of Sharpay’s (Ashley Tisdale) plot to lure him away from Gabriella (Vanessa Hudgens). How will it all turn out? All questions are answered on the night of the club’s Talent Show.",21.01755,United States of America,2007-08-17,7000000,104.0,English,6.1,843,Comedy,Drama,Family,musical,music,summer
1056,The Adventures of Huck Finn,,"Climb aboard for an extraordinary version of Mark Twain's sweeping adventure when Walt Disney presents The Adventures of Huck Finn, starring Elijah Wood (The Lord of the Rings). Directed by Stephen Sommers (The Mummy, The Mummy Returns), it's the unforgettable saga of a mischievous youngster and a runaway slave",2.163683,United States of America,1993-04-02,0,108.0,English,6.2,42,Action,Adventure,Drama,southern accent,wanted man,lynch mob
1064,Mary Poppins,,"The movie combines a diverting story, songs, color and sequences of live action blended with the movements of animated figures. Mary Poppins is a kind of Super-nanny who flies in with her umbrella in response to the request of the Banks children and proceeds to put things right with the aid of her rather extraordinary magical powers before flying off again.",59.961523,United States of America,1964-08-27,102272727,139.0,English,7.4,1183,Comedy,Family,Fantasy,london england,dancing,parents kids relationship
1073,Bend It Like Beckham,http://www2.foxsearchlight.com/benditlikebeckham/,"Jess Bhamra, the daughter of a strict Indian couple in London, is not permitted to play organized soccer, even though she is 18. When Jess is playing for fun one day, her impressive skills are seen by Jules Paxton, who then convinces Jess to play for her semi-pro team. Jess uses elaborate excuses to hide her matches from her family while also dealing with her romantic feelings for her coach, Joe.",22.054546,India,2002-04-11,76578641,112.0,English,6.2,578,Comedy,Drama,Romance,london england,tradition,indian lead
1085,"20,000 Leagues Under the Sea",,"A ship sent to investigate a wave of mysterious sinkings encounters the advanced submarine, the Nautilus, commanded by Captain Nemo.",9.358197,United States of America,1954-12-23,28200000,127.0,English,6.8,157,Adventure,Drama,Science Fiction,diving,ocean,submarine
1092,Doug's 1st Movie,,Doug and his pal Skeeter set's out to find the monster of Lucky Duck Lake. Though things get really out of hand when some one blurts out that the monster is real.,1.88484,United States of America,1999-03-26,0,77.0,English,5.4,22,Animation,Family,Comedy,journalism,dance,daydream
1125,High School Musical,http://tv.disney.go.com/disneychannel/originalmovies/highschoolmusical/index.html,"Troy (Zac Efron), the popular captain of the basketball team, and Gabriella (Vanessa Anne Hudgens), the brainy and beautiful member of the academic club, break all the rules of East High society when they secretly audition for the leads in the school's musical. As they reach for the stars and follow their dreams, everyone learns about acceptance, teamwork, and being yourself. And it's all set to fun tunes and very cool dance moves!",16.536374,United States of America,2006-01-20,0,98.0,English,6.1,1000,Comedy,Drama,Family,becoming an adult,musical,music
1148,Feast,http://www.feast-movie.com/,Patrons locked inside of a bar are forced to fight monsters.,8.825113,United States of America,2005-10-14,658573,95.0,English,6.1,160,Action,Comedy,Horror,monster,pub,duringcreditsstinger
1182,Fantasia,http://movies.disney.com/fantasia,"Walt Disney's timeless masterpiece is an extravaganza of sight and sound! See the music come to life, hear the pictures burst into song and experience the excitement that is Fantasia over and over again.",32.875469,United States of America,1940-11-13,83320000,124.0,English,7.2,808,Animation,Family,Music,orchestra,classical music,musical segments
1246,Bambi,http://movies.disney.com/bambi,"Bambi's tale unfolds from season to season as the young prince of the forest learns about life, love, and friends.",47.651878,United States of America,1942-08-14,267447150,70.0,English,6.8,1405,Animation,Drama,Family,forest,coming of age,best friend
