mid,netflix,amazon_prime,disney_plus,hulu,original_title,homepage,overview,popularity,production_countries,release_date,revenue,runtime,spoken_languages,vote_average,vote_count,genres_1,genres_2,genres_3,keywords_1,keywords_2,keywords_3
630,1,0,0,0,Rain Man,,Selfish yuppie Charlie Babbitt's father left a fortune to his savant brother Raymond and a pittance to Charlie; they travel cross-country.,49.510658,United States of America,1988-12-11,412800000,133.0,Italiano,7.6,1709,Drama,,,individual,mentally disabled,autism
631,1,0,0,0,Gran Torino,http://www.thegrantorino.com/,"Walt Kowalski is a widower who holds onto his prejudices despite the changes in his Michigan neighborhood and the world around him. Kowalski is a grumpy, tough-minded, unhappy old man who can't get along with either his kids or his neighbors. He is a Korean War veteran whose prize possession is a 1972 Gran Torino he keeps in mint condition. When his neighbor Thao, a young Hmong teenager under pressure from his gang member cousin, tries to steal his Gran Torino, Kowalski sets out to reform the youth. Drawn against his will into the life of Thao's family, Kowalski is soon taking steps to protect them from the gangs that infest their neighborhood.",50.7453,United States of America,2008-12-09,269958228,116.0,English,7.8,3086,Drama,,,rape,war veteran,immigration
632,0,1,0,0,Taken,,"While vacationing with a friend in Paris, an American girl is kidnapped by a gang of human traffickers intent on selling her into forced prostitution. Working against the clock, her ex-spy father must pull out all the stops to save her. But with his best years possibly behind him, the job may be more than he can handle.",80.879032,France,2008-02-18,226830568,93.0,English,7.2,4369,Action,Thriller,,paris,kidnapping,human trafficking
633,1,0,0,0,Schindler's List,http://www.schindlerslist.com/,The true story of how businessman Oskar Schindler saved over a thousand Jewish lives from the Nazis while they worked as slaves in his factory during World War II.,104.469351,United States of America,1993-11-29,321365567,195.0,Deutsch,8.3,4329,Drama,History,War,factory,concentration camp,hero
634,1,0,0,0,The Help,http://thehelpmovie.com/#/splash,"Aibileen Clark is a middle-aged African-American maid who has spent her life raising white children and has recently lost her only son; Minny Jackson is an African-American maid who has often offended her employers despite her family's struggles with money and her desperate need for jobs; and Eugenia ""Skeeter"" Phelan is a young white woman who has recently moved back home after graduating college to find out her childhood maid has mysteriously disappeared. These three stories intertwine to explain how life in Jackson, Mississippi revolves around ""the help""; yet they are always kept at a certain distance because of racial lines.",42.191509,India,2011-08-09,124272124,146.0,English,7.8,1910,Drama,,,mississippi,based on novel,exploitation
635,1,0,0,0,Jimmy Neutron: Boy Genius,,"Jimmy Neutron is a boy genius and way ahead of his friends, but when it comes to being cool, he's a little behind. All until one day when his parents, and parents all over Earth are kidnapped by aliens, it's up to him to lead all the children of the world to rescue their parents.",12.739721,United States of America,2001-12-21,80936232,83.0,English,5.6,231,Action,Adventure,Animation,showdown,gi,villain
636,1,0,0,0,Cloverfield,http://www.cloverfieldmovie.com/,"Five young New Yorkers throw their friend a going-away party the night that a monster the size of a skyscraper descends upon the city. Told from the point of view of their video camera, the film is a document of their attempt to survive the most surreal, horrifying event of their lives.",46.942396,United States of America,2008-01-15,170764026,85.0,Pусский,6.4,2251,Action,Thriller,Science Fiction,helicopter,monster,skyscraper
637,1,0,0,0,Teenage Mutant Ninja Turtles II: The Secret of the Ooze,,"The Turtles and the Shredder battle once again, this time for the last cannister of the ooze that created the Turtles, which Shredder wants to create an army of new mutants.",15.505137,Hong Kong,1991-03-22,78000000,88.0,English,5.8,286,Science Fiction,Adventure,Action,crime fighter,fight,mutant
638,0,0,0,1,The Untouchables,,"Young Treasury Agent Elliot Ness arrives in Chicago and is determined to take down Al Capone, but it's not going to be easy because Capone has the police in his pocket. Ness meets Jimmy Malone, a veteran patrolman and probably the most honorable one on the force. He asks Malone to help him get Capone, but Malone warns him that if he goes after Capone, he is going to war.",38.272889,United States of America,1987-06-02,76270454,119.0,English,7.6,1384,Crime,Drama,History,white suit,al capone,tough cop
639,1,0,0,0,No Strings Attached,http://www.nostringsattachedmovie.com/,"Emma is a busy doctor who sets up a seemingly perfect arrangement when she offers her best friend Adam a relationship with one rule: No strings attached. But when a fling becomes a thing, can sex friends stay best friends?",38.688822,United States of America,2011-01-21,147780440,107.0,English,6.1,1331,Comedy,Romance,,father son relationship,casual meeting,student of medicine
640,0,1,0,0,The Omen,,"Immediately after their miscarriage, the US diplomat Robert Thorn adopts the newborn Damien without the knowledge of his wife. Yet what he doesn’t know is that their new son is the son of the devil. A classic horror film with Gregory Peck from 1976.",25.939385,United Kingdom,1976-06-06,60922980,111.0,English,7.2,476,Horror,Thriller,,monk,prophecy,ambassador
641,1,0,0,0,Final Destination 3,,"A student's premonition of a deadly rollercoaster ride saves her life and a lucky few, but not from death itself – which seeks out those who escaped their fate.",31.64341,Canada,2006-02-10,117719158,93.0,English,5.8,974,Horror,Mystery,,beheading,dying and death,stroke of fate
642,1,1,0,0,Hide and Seek,,"David Callaway tries to piece together his life in the wake of his wife's suicide and has been left to raise his nine-year-old daughter, Emily on his own. David is at first amused to discover that Emily has created an imaginary friend named 'Charlie', but it isn't long before 'Charlie' develops a sinister and violent side, and as David struggles with his daughter's growing emotional problems, he comes to the frightening realisation that 'Charlie' isn't just a figment of Emily's imagination.",18.228538,United States of America,2005-01-27,122644820,101.0,English,6.1,440,Horror,Mystery,Thriller,house,imaginary friend,suspense
643,1,0,0,0,GoodFellas,http://www.warnerbros.com/goodfellas,"The true story of Henry Hill, a half-Irish, half-Sicilian Brooklyn kid who is adopted by neighbourhood gangsters at an early age and climbs the ranks of a Mafia family under the guidance of Jimmy Conway.",63.654244,United States of America,1990-09-12,46836394,145.0,Italiano,8.2,3128,Drama,Crime,,prison,based on novel,florida
644,1,0,0,0,Nothing to Lose,,"Advertising executive Nick Beame learns that his wife is sleeping with his employer. In a state of despair, he encounters a bumbling thief whose attempted carjacking goes awry when Nick takes him on an involuntary joyride. Soon the betrayed businessman and the incompetent crook strike up a partnership and develop a robbery-revenge scheme. But it turns out that some other criminals in the area don't appreciate the competition.",8.618208,United States of America,1997-07-18,0,97.0,English,6.3,174,Action,Adventure,Comedy,rap music,infidelity,security camera
645,1,0,0,0,Money Talks,,"Money Talks is a 1997 American comedy film directed by Brett Ratner. Sought by police and criminals, a small-time huckster makes a deal with a TV newsman for protection.",7.615653,United States of America,1997-08-22,0,97.0,English,5.9,87,Action,Adventure,Comedy,prison,diamant,liberation of prisoners
646,1,0,0,0,There Will Be Blood,,"When ruthless oil prospector, Daniel Plainview learns of oil-rich land in California that can be bought cheaply, he moves his operation there and begins manipulating and exploiting the local landowners into selling him their property. Using his young adopted son to project the image of a caring family man, Plainview gains the cooperation of almost all the locals with lofty promises to build schools and cultivate the land to make their community flourish. Over time, Plainview's gradual accumulation of wealth and power causes his true self to surface, and he begins to slowly alienate himself from everyone in his life.",37.817905,United States of America,2007-12-28,77208711,158.0,English,7.9,1537,Drama,,,brother brother relationship,deaf-mute,american dream
647,0,1,0,0,Rugrats Go Wild,,"Rugrats Go Wild is a 2003 crossover animated film, with two animated Nickelodeon television series Rugrats and The Wild Thornberrys.The film was produced by Klasky Csupo and released in theaters on June 13, 2003 by Paramount Pictures and Nickelodeon Movies. It also makes this the Rugrats series finale, after the show ceased production. As there are currently no further Rugrats movies in production, Rugrats Go Wild stands as the final Rugrats film. It is the only Nickelodeon film to be a crossover. Although it is a crossover film, it is primarily a Rugrats movie as the main plot focuses on the those characters.The Rugrats family vacation takes an exotic detour when their boat capsizes and they become shipwrecked on a deserted tropical island. With the jungle as their new backyard, the babies reace wildly from one dangerous adventure to the next…soon to discover that someone else is on the island. It's The Wild Thornberrys...on an island adventure of their own!",8.255708,United States of America,2003-06-13,0,84.0,English,5.6,61,Animation,Family,,kids and family,,
648,1,0,0,0,What a Girl Wants,,"An American girl, Daphne, heads to Europe in search of the father she's never met. But instead of finding a British version of her bohemian mother, she learns the love of her mom's life is an uptight politician. The only problem now is that her long-lost dad is engaged to a fiercely territorial social climber with a daughter who makes Daphne's life miserable.",7.057765,United States of America,2003-03-27,0,105.0,English,5.8,368,Comedy,,,london england,england,daughter
649,1,0,0,0,Good Luck Chuck,http://www.goodluckchuckthemovie.com/,"Cursed since childhood, dentist Charlie Kagan cannot find the right woman. Even worse, he learns that each of his ex-girlfriends finds true love with the man she meets after her relationship with him ends. Hearing of Charlie's reputation as a good-luck charm, women from all over line up for a quick tryst. But when Charlie meets the woman of his dreams, he must find a way to break the curse or risk losing her to the next man she meets.",21.729434,Canada,2007-09-21,59192128,101.0,English,5.5,444,Comedy,Drama,Romance,sex,aquarium,nudity
650,1,0,0,0,Cradle 2 the Grave,,"Gang leader Tony pulls off a major diamond heist with his crew, but cop-turned-criminal Ling knows who has the loot and responds by kidnapping Tony's daughter and holding her for ransom. Unfortunately, Tony's lost the diamonds as well. As he frantically searches for his daughter and the jewels, Tony pairs with a high-kicking government agent who once worked with Ling and seeks revenge on him.",12.837116,United States of America,2003-02-28,56489558,101.0,English,5.8,236,Action,Crime,Drama,robbery,diamant,intelligence
651,0,1,0,0,The Sitter,,"Noah, is not your typical entertain-the-kids-no-matter-how-boring-it-is kind of sitter. He's reluctant to take a sitting gig; he'd rather, well, be doing anything else, especially if it involves slacking. When Noah is watching the neighbor's kid he gets a booty call from his girlfriend in the city. To hook up with her, Noah takes to the streets, but his urban adventure spins out of control as he finds himself on the run from a maniacal drug lord.",19.428994,United States of America,2011-12-09,34942188,81.0,English,5.4,325,Comedy,,,babysitter,duringcreditsstinger,
652,1,0,0,0,Crocodile Dundee in Los Angeles,,"After settling in the tiny Australian town of Walkabout Creek with his significant other and his young son, Mick ""Crocodile"" Dundee is thrown for a loop when a prestigious Los Angeles newspaper offers his honey a job. The family migrates back to the United States, and Croc and son soon find themselves learning some lessons about American life -- many of them inadvertent",6.081772,Australia,2001-04-12,39438674,92.0,English,4.7,146,Adventure,Comedy,,crocodile,traffic jam,los angeles
653,1,0,0,1,Kingpin,,"After bowler Roy Munson swindles the wrong crowd and is left with a hook for a hand, he settles into impoverished obscurity. That is, until he uncovers the next big thing: an Amish kid named Ishmael. So, the corrupt and the hopelessly naïve hit the circuit intent on settling an old score with Big Ern.",17.329269,United States of America,1996-07-04,25023434,113.0,English,6.7,244,Comedy,,,sport,handicap,sexual favor
654,0,1,0,0,The Gambler,http://www.thegamblermovie.com/,"Literature professor Jim Bennett leads a secret life as a high-stakes gambler. Always a risk-taker, Bennett bets it all when he borrows from a gangster and offers his own life as collateral. Staying one step ahead, he pits his creditor against the operator of an illicit gambling ring while garnering the attention of Frank, a paternalistic loan shark. As his relationship with a student deepens, Bennett must risk everything for a second chance.",22.622453,United States of America,2014-12-25,39171130,111.0,English,5.7,543,Thriller,Crime,Drama,gambling,gun,professor
655,1,0,0,0,August: Osage County,,"A look at the lives of the strong-willed women of the Weston family, whose paths have diverged until a family crisis brings them back to the Midwest house they grew up in, and to the dysfunctional woman who raised them.",20.561682,United States of America,2013-12-26,74188937,121.0,English,6.9,483,Comedy,Drama,,suicide,drug addiction,funeral
656,0,0,1,0,Ice Princess,,"With the help of her coach, her parents, and the boy who drives the Zamboni machine, nothing can stop Casey (Trachtenberg) from realizing her dream to be a champion figure skater.",13.288177,United States of America,2005-03-17,27645491,98.0,English,5.9,185,Drama,Comedy,Family,sport,figure skating,teenage girl
657,0,0,1,0,Eddie the Eagle,http://www.foxmovies.com/movies/eddie-the-eagle,"Inspired by true events, Eddie the Eagle is a feel-good story about Michael ""Eddie"" Edwards (Taron Egerton), an unlikely but courageous British ski-jumper who never stopped believing in himself - even as an entire nation was counting him out. With the help of a rebellious and charismatic coach (played by Hugh Jackman), Eddie takes on the establishment and wins the hearts of sports fans around the world by making an improbable and historic showing at the 1988 Calgary Winter Olympics.",29.365851,Germany,2016-02-26,46152800,106.0,English,7.2,661,Comedy,Drama,History,underdog,olympic games,ski jump
658,1,0,0,0,Dear John,,Sergeant John Tyree is home on a 2 week leave from Germany. He meets Savannah after he dives into the ocean to retrieve Savannah's purse that had fallen off the pier. John falls in love with Savannah who is a student on spring break helping build a house for Habitat for Humanity. A romance occurs and Savannah falls deeply in love with John. She promises to write John overseas until he returns.,19.402816,United States of America,2010-02-04,114977104,115.0,English,6.6,1262,Drama,Romance,War,based on novel,army,love
659,1,0,0,0,The Losers,http://www.the-losers.com/,"A tale of double cross and revenge, centered upon the members of an elite U.S. Special Forces unit sent into the Bolivian jungle on a search and destroy mission. The team-Clay, Jensen, Roque, Pooch and Cougar -find themselves the target of a lethal betrayal instigated from inside by a powerful enemy known only as Max. Presumed dead, the group makes plans to even the score when they're joined by the mysterious Aisha, a beautiful operative with her own agenda. Working together, they must remain deep undercover while tracking the heavily-guarded Max, a ruthless man bent on embroiling the world in a new high-tech global war.",24.903418,United States of America,2010-04-23,23580000,97.0,English,6.2,515,Action,Adventure,Crime,hospital,black ops,reference to macgyver
660,1,0,0,0,Don't Be Afraid of the Dark,http://www.dontbeafraidofthedark.com/,A young girl sent to live with her father and his new girlfriend discovers creatures in her new home who want to claim her as one of their own.,14.562197,United States of America,2010-11-06,36993168,99.0,English,5.4,341,Fantasy,Horror,Thriller,monster,remake,creature
661,1,0,0,0,War,,"FBI agent Jack Crawford is out for revenge when his partner is killed and all clues point to the mysterious assassin Rogue. But when Rogue turns up years later to take care of some unfinished business, he triggers a violent clash of rival gangs. Will the truth come out before it's too late? And when the dust settles, who will remain standing?",18.896239,United States of America,2007-08-24,40452643,103.0,广州话 / 廣州話,6.0,414,Action,Thriller,Crime,fbi,revenge,fbi agent
662,1,0,0,0,Unaccompanied Minors,,Five disparate kids snowed in at the airport on Christmas Eve learn some lessons about friendship when they launch a bid to get back to their families and outsmart a disgruntled airport official who wants to keep them grounded.,10.006282,special,2006-12-08,0,90.0,English,5.4,66,Comedy,Family,,holiday,,
663,0,0,1,0,The Greatest Game Ever Played,,"A biopic of 20-year-old Francis Ouimet who defeated his golfing idol and 1900 US Open Champion, Harry Vardon.",7.538513,United States of America,2005-09-30,15431177,120.0,English,6.9,110,Drama,Family,,sport,,
664,1,1,0,1,The Box,http://thebox-movie.warnerbros.com/,"Norma and Arthur Lewis, a suburban couple with a young child, receive a simple wooden box as a gift, which bears fatal and irrevocable consequences. A mysterious stranger delivers the message that the box promises to bestow upon its owner $1 million with the press of a button. However pressing this button will simultaneously cause the death of another human being somewhere in the world; someone they don't know. With just 24 hours to have the box in their possession, Norma and Arthur find themselves in the cross-hairs of a startling moral dilemma and must face the true nature of their humanity.",21.606001,United States of America,2009-09-17,33333531,115.0,English,5.4,597,Thriller,Science Fiction,,experiment,homicide,key
665,0,1,0,0,The Ruins,,"A group of friends whose leisurely Mexican holiday takes a turn for the worse when they, along with a fellow tourist embark on a remote archaeological dig in the jungle, where something evil lives among the ruins",13.715715,United States of America,2008-04-02,0,91.0,English,5.6,265,Drama,Horror,,maya civilization,carnivorous plant,cancún
666,0,0,0,1,My Soul to Take,,A serial killer returns to his hometown to stalk seven children who share the same birthday as the date he was allegedly put to rest.,7.001176,United States of America,2010-10-08,19829957,107.0,English,5.2,147,Drama,Horror,Mystery,soul,serial killer,slasher
667,1,0,0,0,Maximum Risk,,"A policeman takes his twin brother's place and inherits his problems and a beautiful girlfriend. He is forced to kickbox his way from France to the U.S. and back while playing footsie with the FBI and Russian mafia. Not just muscles with a badge, the policeman must find the answers to some tough questions, none harder than what the heck is an accordian player doing in a sauna.",10.115011,United States of America,1996-09-13,51702483,100.0,English,5.2,101,Action,Adventure,Thriller,mistake in person,dying and death,twin brother
668,1,1,0,0,Legend,https://www.uphe.com/movies/legend-2015,"Suave, charming and volatile, Reggie Kray and his unstable twin brother Ronnie start to leave their mark on the London underworld in the 1960s. Using violence to get what they want, the siblings orchestrate robberies and murders while running nightclubs and protection rackets. With police Detective Leonard ""Nipper"" Read hot on their heels, the brothers continue their rapid rise to power and achieve tabloid notoriety.",32.854557,United Kingdom,2015-09-09,42972994,131.0,English,6.7,973,Crime,Thriller,,biography,based on true story,gangster
669,1,1,0,0,Hot Rod,,"For Rod Kimball, performing stunts is a way of life, even though he is rather accident-prone. Poor Rod cannot even get any respect from his stepfather, Frank, who beats him up in weekly sparring matches. When Frank falls ill, Rod devises his most outrageous stunt yet to raise money for Frank's operation -- and then Rod will kick Frank's butt.",6.309587,United States of America,2007-08-03,14334401,88.0,English,6.3,313,Action,Comedy,,stuntman,step father,swimming pool
670,1,0,0,0,Shark Night,http://www.iamrogue.com/sharknight3d/fullsite/index.html,A weekend at a lake house in the Louisiana Gulf turns into a nightmare for seven vacationers as they are subjected to fresh-water shark attacks.,8.363702,United States of America,2011-09-02,10126458,91.0,English,4.9,132,Horror,Thriller,,shark attack,louisiana,dirty cop
671,0,1,0,0,Angela's Ashes,,"Based on the best selling autobiography by Irish expat Frank McCourt, Angela's Ashes follows the experiences of young Frankie and his family as they try against all odds to escape the poverty endemic in the slums of pre-war Limerick. The film opens with the family in Brooklyn, but following the death of one of Frankie's siblings, they return home, only to find the situation there even worse. Prejudice against Frankie's Northern Irish father makes his search for employment in the Republic difficult despite his having fought for the IRA, and when he does find money, he spends the money on drink.",4.88794,Ireland,1999-12-25,13,145.0,English,7.0,59,Drama,,,emigration,irish-american,hunger
672,0,0,0,1,The 33,,"Based on a true story about the collapse at the mine in San Jose, Chile that  left 33 miners isolated underground for 69 days.",10.699952,United States of America,2015-08-06,24902723,120.0,Español,6.0,378,Drama,History,,mining,chile,based on true story
673,0,0,0,1,The Possession,http://www.thepossessionmovie.com/,"A young girl buys an antique box at a yard sale, unaware that inside the collectible lives a malicious ancient spirit. The girl's father teams with his ex-wife to find a way to end the curse upon their child.",21.680424,United States of America,2012-08-30,85446075,92.0,English,5.8,498,Horror,Thriller,,,,
674,1,0,0,0,King's Ransom,,"Hoping to foil his own gold-digging wife's plan, a loathsome businessman arranges his own kidnapping, only to realize that there are plenty of other people interested in his wealth as well.",5.079017,Canada,2005-04-22,0,95.0,English,5.1,14,Comedy,Crime,,caper,action,
675,0,0,0,1,Star Trek IV: The Voyage Home,,"Fugitives of the Federation for their daring rescue of Spock from the doomed Genesis Planet, Admiral Kirk (William Shatner) and his crew begin their journey home to face justice for their actions. But as they near Earth, they find it at the mercy of a mysterious alien presence whose signals are slowly destroying the planet. In a desperate attempt to answer the call of the probe, Kirk and his crew race back to the late twentieth century. However they soon find the world they once knew to be more alien than anything they've encountered in the far reaches of the galaxy!",22.258428,United States of America,1986-11-25,133000000,119.0,English,6.9,477,Science Fiction,Adventure,,saving the world,san francisco,uss enterprise-a
676,1,0,0,0,Scream 2,,"Two years after the terrifying events that occurred in Woodsboro, Sidney is now attending Windsor College in Cincinnati, and Gale Weathers' best selling book on Sidney's life has now been made into a major motion picture. When two college students are killed in a theatre while watching the new film 'Stab', Sidney knows deep down that history is repeating itself.",35.244037,United States of America,1997-12-09,172363301,120.0,English,6.1,840,Horror,Mystery,,film festivals,slaughter,slasher
677,1,0,0,0,The Whole Nine Yards,,"A mobster named Jimmy the Tulip agrees to cooperate with an FBI investigation in order to stay out of prison; he's relocated by the authorities to a life of suburban anonymity as part of a witness protection program. It's not long before a couple of his new neighbors figure out his true identity and come knocking to see if he'd be up for one more hit, suburban style.",23.441135,Canada,2000-02-18,106371651,98.0,English,6.2,531,Comedy,Crime,,bounty,gangster boss,montreal
678,0,0,0,1,Footloose,,"When teenager Ren and his family move from big-city Chicago to a small town in the West, he's in for a real case of culture shock.",25.03414,United States of America,1984-02-17,80035402,107.0,English,6.4,505,Drama,Family,Music,dancing,dancer,dance
679,0,1,0,0,I Still Know What You Did Last Summer,,"Unfinished business with coed Julie James brings the murderer to the Bahamas to terrorize her and her friends, Karla, Tyrell and Will, during a vacation. Can Ray Bronson who survived a bloody attack alongside Julie two summers ago, get to the island in time to save everyone?",20.793026,United States of America,1998-11-13,40002112,100.0,English,5.1,374,Horror,Mystery,Thriller,competition,island,radio
680,1,0,0,0,Zack and Miri Make a Porno,http://www.zackandmiri.com,"Lifelong platonic friends Zack and Miri look to solve their respective cash-flow problems by making an adult film together. As the cameras roll, however, the duo begin to sense that they may have more feelings for each other than they previously thought.",27.326466,United States of America,2008-09-18,42105111,102.0,English,6.1,721,Comedy,,,pornography,love of one's life,platonic love
