mid,netflix,amazon_prime,disney_plus,hulu,original_title,homepage,overview,popularity,production_countries,release_date,revenue,runtime,spoken_languages,vote_average,vote_count,genres_1,genres_2,genres_3,keywords_1,keywords_2,keywords_3
299,1,0,0,0,The Love Guru,http://www.lovegurumovie.com/,"Born in America and raised in an Indian ashram, Pitka returns to his native land to seek his fortune as a spiritualist and self-help expert. His skills are put to the test when he must get a brokenhearted hockey player's marriage back on track in time for the man to help his team win the Stanley Cup.",13.218008,United States of America,2008-06-20,41819064,87.0,English,4.3,242,Comedy,Romance,,sport,ice hockey,guru
300,1,0,0,0,The Hateful Eight,http://thehatefuleight.com/,Bounty hunters seek shelter from a raging blizzard and get caught up in a plot of betrayal and deception.,68.717016,United States of America,2015-12-25,155760117,167.0,Español,7.6,4274,Crime,Drama,Mystery,bounty hunter,wyoming,mountains
301,1,0,0,0,Hop,http://www.iwantcandy.com/,"E.B., the Easter Bunny's teenage son, heads to Hollywood, determined to become a drummer in a rock 'n' roll band. In LA, he's taken in by Fred after the out-of-work slacker hits E.B. with his car.",16.791058,United Kingdom,2011-03-30,183953723,95.0,English,5.5,331,Animation,Comedy,Family,coup d'etat,slacker,easter
302,0,1,0,0,Marley & Me,http://marleyandmemovie.com/,"A newly married couple who, in the process of starting a family, learn many of life's important lessons from their trouble-loving retriever, Marley. Packed with plenty of laughs to lighten the load, the film explores the highs and lows of marriage, maturity and confronting one's own mortality, as seen through the lens of family life with a dog.",30.951203,United States of America,2008-12-25,244082376,115.0,English,6.9,1343,Comedy,Family,,journalist,based on novel,puppy
303,1,0,1,0,Chicken Little,http://movies.disney.com/chicken-little,"When the sky really is falling and sanity has flown the coop, who will rise to save the day? Together with his hysterical band of misfit friends, Chicken Little must hatch a plan to save the planet from alien invasion and prove that the world's biggest hero is a little chicken.",47.973995,United States of America,2005-11-04,314432665,81.0,English,5.6,944,Animation,Family,Comedy,fish,small town,space marine
304,0,0,0,1,Gone Girl,http://www.gonegirlmovie.com/,"With his wife's disappearance having become the focus of an intense media circus, a man sees the spotlight turned on him when it's suspected that he may not be innocent.",143.041543,United States of America,2014-10-01,369330363,145.0,English,7.9,5862,Mystery,Thriller,Drama,based on novel,marriage crisis,disappearance
305,1,1,0,1,GoldenEye,http://www.mgm.com/view/movie/757/Goldeneye/,James Bond must unmask the mysterious head of the Janus Syndicate and prevent the leader from utilizing the GoldenEye weapons system to inflict devastating revenge on Britain.,59.824565,United Kingdom,1995-11-16,352194034,130.0,English,6.6,1174,Adventure,Action,Thriller,cuba,falsely accused,secret identity
306,1,0,0,0,Daddy Day Care,,"Two men get laid off and have to become stay-at-home dads when they can't find jobs, which inspires them to open their own day-care center.",18.106021,United States of America,2003-05-03,164433867,92.0,English,5.6,506,Comedy,Family,,competition,success,kindergarten
307,0,0,1,0,Cheaper by the Dozen 2,,"Steve Martin and Bonnie Hunt return as heads of the Baker family who, while on vacation, find themselves in competition with a rival family of eight children, headed by Eugene Levy,",18.831023,United States of America,2005-12-21,129181830,94.0,English,5.7,526,Comedy,,,holiday,lake,big family
308,1,0,0,0,Eat Pray Love,http://www.sonypictures.com/movies/eatpraylove/,"Liz Gilbert had everything a modern woman is supposed to dream of having – a husband, a house and a successful career – yet like so many others, she found herself lost, confused and searching for what she really wanted in life. Newly divorced and at a crossroads, Gilbert steps out of her comfort zone, risking everything to change her life, embarking on a journey around the world that becomes a quest for self-discovery. In her travels, she discovers the true pleasure of nourishment by eating in Italy, the power of prayer in India and, finally and unexpectedly, the inner peace and balance of true love in Bali.",28.800112,United States of America,2010-08-12,204594016,133.0,Português,5.8,636,Drama,,,indonesia,female protagonist,india
309,0,0,0,1,Jack Reacher,http://www.jackreachermovie.com/,"In an innocent heartland city, five are shot dead by an expert sniper. The police quickly identify and arrest the culprit, and build a slam-dunk case. But the accused man claims he's innocent and says ""Get Jack Reacher."" Reacher himself sees the news report and turns up in the city. The defense is immensely relieved, but Reacher has come to bury the guy. Shocked at the accused's request, Reacher sets out to confirm for himself the absolute certainty of the man's guilt, but comes up with more than he bargained for.",56.868399,United States of America,2012-12-20,218340595,130.0,English,6.3,2998,Crime,Drama,Thriller,based on novel,sniper,investigation
310,1,0,0,0,Deep Blue Sea,,"On a remote former submarine refueling facility called Aquatica, a team of scientists are searching for a cure for Alzheimer's disease. Dr. Susan McAlester genetically engineers three Mako sharks, intending to increase their brain capacity so that they can harvest the tissue as a cure for Alzheimer's. Unfortunately, the increased brain capacity also makes the sharks smarter, faster, and more dangerous. Aquatica's financial backers are skeptical and nervous about the tests, and send a corporate executive to visit the facility.",22.991269,Australia,1999-07-28,73648228,105.0,English,5.6,604,Action,Science Fiction,Thriller,shark attack,shark,alzheimer's disease
311,1,0,0,0,Coraline,http://coraline.com/,"When Coraline moves to an old house, she feels bored and neglected by her parents. She finds a hidden door with a bricked up passage. During the night, she crosses the passage and finds a parallel world where everybody has buttons instead of eyes, with caring parents and all her dreams coming true. When the Other Mother invites Coraline to stay in her world forever, the girl refuses and finds that the alternate reality where she is trapped is only a trick to lure her.",51.146047,United States of America,2009-02-05,124596398,100.0,English,7.3,1386,Animation,Family,,dream,eye,stuffed animal
312,0,0,1,0,The Shaggy Dog,http://movies.disney.com/the-shaggy-dog-2006,The tale of a workaholic dad-turned-dog who finds that being man's best friend shows him the most important job - being a great dad.,4.280619,United States of America,2006-03-09,61112916,98.0,English,4.5,137,Comedy,Family,,father son relationship,parents kids relationship,workaholic
313,1,0,0,0,Starsky & Hutch,,"Join uptight David Starsky and laid-back Ken ""Hutch"" Hutchinson as they're paired for the first time as undercover cops. The new partners must overcome their differences to solve an important case with help from street informant Huggy Bear and persuasive criminal Reese Feldman.",28.848842,United States of America,2004-03-05,170268750,101.0,English,5.6,644,Comedy,Crime,,informant,jumping from a rooftop,surveillance footage
314,1,0,0,0,Hellboy,http://www.sonypictures.com/homevideo/hellboy/,"In the final days of World War II, the Nazis attempt to use black magic to aid their dying cause. The Allies raid the camp where the ceremony is taking place, but not before a demon - Hellboy - has already been conjured. Joining the Allied forces, Hellboy eventually grows to adulthood, serving the cause of good rather than evil.",47.479755,United States of America,2004-04-02,99318987,122.0,Pусский,6.5,2225,Fantasy,Action,Science Fiction,black magic,fistfight,cover-up
315,1,0,0,0,ParaNorman,http://paranorman.com,"In the town of Blithe Hollow, Norman Babcock is a boy who can speak to the dead, but no one besides his eccentric new friend, Neil, believes his ability is real. One day, Norman's estranged eccentric uncle tells him of an important annual ritual he must take up to protect the town from an curse cast by a witch it condemned centuries ago. Eventually, Norman decides to cooperate, but things don't go according to plan. Now, a magic storm of the witch threatens Blithe Hollow as the accursed dead rise. Together with unexpected new companions, Norman struggles to save his town, only to discover the horrific truth of the curse. With that insight, Norman must resolve the crisis for good as only he can.",39.539045,United States of America,2012-08-03,107139399,90.0,English,6.7,789,Family,Animation,Adventure,medium,stop motion,curse
316,0,0,0,1,The Jackal,,"Hired by a powerful member of the Russian mafia to avenge an FBI sting that left his brother dead, the perfectionist Jackal proves an elusive target for the men charged with the task of bringing him down: a deputy FBI boss and a former IRA terrorist.",19.747459,United States of America,1997-11-14,159330280,124.0,English,6.1,527,Action,Thriller,Adventure,fbi,cold war,hitman
317,1,0,0,0,The Tuxedo,,"Cabbie-turned-chauffeur Jimmy Tong learns there is really only one rule when you work for playboy millionaire Clark Devlin : Never touch Devlin's prized tuxedo. But when Devlin is temporarily put out of commission in an explosive accident, Jimmy puts on the tux and soon discovers that this extraordinary suit may be more black belt than black tie. Paired with a partner as inexperienced as he is, Jimmy becomes an unwitting secret agent.",21.549232,United States of America,2002-09-27,0,98.0,广州话 / 廣州話,5.3,483,Thriller,Action,Comedy,bomb,intelligence,chauffeur
318,0,1,0,0,Jack Ryan: Shadow Recruit,,"Jack Ryan, as a young covert CIA analyst, uncovers a Russian plot to crash the U.S. economy with a terrorist attack.",42.538258,Russia,2014-01-15,50549107,105.0,English,5.9,1173,Action,Drama,Thriller,london england,corruption,cia
319,1,0,0,0,Joy,http://www.foxmovies.com/movies/joy,A story based on the life of a struggling Long Island single mom who became one of the country's most successful entrepreneurs.,29.876507,United States of America,2015-12-24,101134059,124.0,Español,6.4,1581,Drama,Comedy,,factory,inventor,strong woman
320,1,0,0,0,Invictus,http://invictusmovie.warnerbros.com,"Newly elected President Nelson Mandela knows his nation remains racially and economically divided in the wake of apartheid. Believing he can bring his people together through the universal language of sport, Mandela rallies South Africa's rugby team as they make their historic run to the 1995 Rugby World Cup Championship match.",23.85119,United States of America,2009-12-10,122233971,134.0,English,7.0,1125,Drama,History,,stadium,south africa,apartheid
321,1,0,0,0,State of Play,http://www.stateofplaymovie.net/,"Handsome, unflappable U.S. Congressman Stephen Collins is the future of his political party: an honorable appointee who serves as the chairman of a committee overseeing defense spending. All eyes are upon the rising star to be his party's contender for the upcoming presidential race. Until his research assistant/mistress is brutally murdered and buried secrets come tumbling out.",21.685719,France,2009-04-17,87784194,127.0,广州话 / 廣州話,6.7,484,Action,,,corruption,assassination,detective
322,0,1,0,0,Duplicity,http://www.universalstudiosentertainment.com/duplicity/,Two romantically-engaged corporate spies team up to manipulate a corporate race to corner the market on a medical innovation that will reap huge profits and enable them to lead an extravagant lifestyle together.,13.630049,Germany,2009-03-19,60000000,125.0,English,5.7,201,Romance,Comedy,Crime,spy,,
323,0,0,1,0,My Favorite Martian,,"News producer, Tim O'Hara gets himself fired for unwillingly compromising his bosses' daughter during a live transmission. A little later, he witnesses the crashing of a small Martian spacecraft, realizing his one-time chance of delivering a story that will rock the earth. Since Tim took the original but scaled-down spaceship with him, the Martian follows him to retrieve it.",6.80692,United States of America,1999-02-11,36850101,94.0,English,5.1,80,Comedy,Drama,Family,alien,martian,based on tv series
324,1,0,0,0,Planet 51,http://www.sonypictures.com/movies/planet51/,"When Earth astronaut Capt. Chuck Baker arrives on Planet 51 -- a world reminiscent of American suburbia circa 1950 -- he tries to avoid capture, recover his spaceship and make it home safely, all with the help of an empathetic little green being.",23.661071,Spain,2009-11-19,104945765,91.0,English,5.6,556,Science Fiction,Animation,Family,flying saucer,alien life-form,spaceship
325,0,0,0,1,Star Trek: Nemesis,,"En route to the honeymoon of William Riker to Deanna Troi on her home planet of Betazed, Captain Jean-Luc Picard and the crew of the U.S.S. Enterprise receives word from Starfleet that a coup has resulted in the installation of a new Romulan political leader, Shinzon, who claims to seek peace with the human-backed United Federation of Planets. Once in enemy territory, the captain and his crew make a startling discovery: Shinzon is human, a slave from the Romulan sister planet of Remus, and has a secret, shocking relationship to Picard himself.",21.605533,United States of America,2002-12-13,67312826,117.0,English,6.1,479,Science Fiction,Action,Adventure,clone,assassination,ambush
326,1,0,0,0,Righteous Kill,http://www.righteouskill-themovie.com,"Two veteran New York City detectives work to identify the possible connection between a recent murder and a case they believe they solved years ago; is there a serial killer on the loose, and did they perhaps put the wrong person behind bars?",18.380176,United States of America,2008-09-11,73174566,101.0,Pусский,5.9,375,Action,Crime,Drama,revenge,murder,plot twist
327,0,0,0,1,Mercury Rising,,"Renegade FBI agent Art Jeffries protects a nine-year-old autistic boy who has cracked the government's new ""unbreakable"" code.",18.877795,United States of America,1998-04-03,0,111.0,English,6.0,368,Action,Crime,Drama,assassin,loss of family,autism
328,0,1,0,0,The Legend of Bagger Vance,,"World War I has left golfer Rannulph Junuh a poker-playing alcoholic, his perfect swing gone. Now, however, he needs to get it back to play in a tournament to save the financially ravaged golf course of a long-ago sweetheart. Help arrives in the form of mysterious caddy Bagger Vance.",16.848899,United States of America,2000-11-02,39459427,126.0,English,6.3,251,Fantasy,Drama,,competition,world war i,great depression
329,0,1,0,0,Almost Famous,,"Almost Famous is an autobiographical inspired film about a 15-year-old who is hired by Rolling Stone magazine to follow and interview a rock band during their tour. A film about growing up, first love, disappointment, and the life of a rock star.",21.547446,United States of America,2000-09-15,47383689,122.0,English,7.4,797,Drama,Music,,hotel room,san diego,drug addiction
330,0,0,1,0,Garfield: A Tail of Two Kitties,,"Garfield is back and this time Garfield and his canine sidekick Odie follows their owner, Jon Arbuckle, to England, the U.K. may never recover, as Garfield is mistaken for a look-alike, regal cat who has inherited a castle.",16.930969,United Kingdom,2006-06-15,141702264,78.0,English,5.1,464,Animation,Comedy,Family,london england,cat,mistake in person
331,0,1,0,1,Priest,http://www.priest-themovie.com/,"In an alternate world, humanity and vampires have warred for centuries. After the last Vampire War, the veteran Warrior Priest lives in obscurity with other humans inside one of the Church's walled cities. When the Priest's niece is kidnapped by vampires, the Priest breaks his vows to hunt them down. He is accompanied by the niece's boyfriend, who is a wasteland sheriff, and a former Warrior Priestess.",28.350927,United States of America,2011-05-05,78309131,87.0,Português,5.4,692,Action,Science Fiction,Fantasy,vampire,crucifixion,post-apocalyptic
332,0,0,0,1,Sinbad: Legend of the Seven Seas,http://sinbad-themovie.com/main.html,"The sailor of legend is framed by the goddess Eris for the theft of the Book of Peace, and must travel to her realm at the end of the world to retrieve it and save the life of his childhood friend Prince Proteus.",18.815442,United States of America,2003-07-02,26288320,86.0,广州话 / 廣州話,6.6,372,Family,Animation,Adventure,prince,water monster,
333,1,0,0,0,Event Horizon,,"In the year 2047 a group of astronauts are sent to investigate and salvage the long lost starship ""Event Horizon"". The ship disappeared mysteriously 7 years before on its maiden voyage and with its return comes even more mystery as the crew of the ""Lewis and Clark"" discover the real truth behind its disappearance and something even more terrifying.",29.787135,United Kingdom,1997-08-15,26673242,96.0,English,6.5,742,Horror,Science Fiction,Mystery,space marine,nudity,nightmare
334,0,0,0,1,The Last Castle,,A Court Martialed general rallies together 1200 inmates to rise against the system that put him away.,15.433244,United States of America,2001-10-19,27642707,131.0,English,7.0,285,Action,Drama,Thriller,prison,general,
335,0,0,0,1,Supernova,,"Set in the 22nd century, when a battered salvage ship sends out a distress signal, the seasoned crew of the rescue hospital ship Nova-17 responds. What they find is a black hole--that threatens to destroy both ships--and a mysterious survivor whose body quickly mutates into a monstrous and deadly form.",5.762037,Switzerland,2000-01-14,14828081,91.0,English,4.9,109,Horror,Science Fiction,Thriller,black people,starships,future
336,1,0,0,0,Inkheart,http://www.inkheartmovie.com/,"The adventures of a father and his young daughter, in their search for a long lost book that will help reunite a missing, close relative.",27.018886,Germany,2008-12-11,57490374,106.0,English,6.0,592,Adventure,Family,Fantasy,book,fairy tale,eavesdropping
337,1,0,0,0,The Great Raid,,"As World War II rages, the elite Sixth Ranger Battalion is given a mission of heroic proportions: push 30 miles behind enemy lines and liberate over 500 American prisoners of war.",8.923215,United States of America,2005-08-12,10166502,132.0,English,6.8,91,Action,History,War,based on novel,world war ii,prisoners of war
338,1,0,0,0,The Flintstones in Viva Rock Vegas,http://www.vivarockvegas.com/,"The Flintstones are at it again. The Flintstones and the Rubbles head for Rock Vegas with Fred hoping to court the lovely Wilma. Nothing will stand in the way of love, except for the conniving Chip Rockefeller who is the playboy born in Baysville but who has made it in the cutthroat town of Rock Vegas. Will Fred win Wilma's love?",6.248309,United States of America,2000-04-28,59468275,90.0,English,4.4,134,Science Fiction,Comedy,Family,waitress,marriage proposal,flirt
339,1,0,0,0,The Ridiculous 6,http://www.netflix.com/title/80039517,"When his long-lost outlaw father returns, Tommy ""White Knife"" Stockburn goes on an adventure-filled journey across the Old West with his five brothers.",19.694695,United States of America,2015-12-11,0,119.0,English,4.9,388,Comedy,Western,,wild west,,
340,1,0,0,0,Resident Evil: Afterlife,http://www.sonypictures.com/movies/residentevilafterlife/site/,"In a world ravaged by a virus infection, turning its victims into the Undead, Alice continues on her journey to find survivors and lead them to safety. Her deadly battle with the Umbrella Corporation reaches new heights, but Alice gets some unexpected help from an old friend. A new lead that promises a safe haven from the Undead takes them to Los Angeles, but when they arrive the city is overrun by thousands of Undead - and Alice and her comrades are about to step into a deadly trap.",2.143764,Germany,2010-09-09,300228084,97.0,English,5.8,1363,Action,Adventure,Horror,post-apocalyptic,dystopia,undead
341,0,0,1,0,Red Tails,http://www.redtails2012.com/,"The story of the Tuskegee Airmen, the first African-American pilots to fly in a combat squadron during World War II.",12.29603,United States of America,2012-01-19,50365377,125.0,English,5.9,178,Drama,Action,Adventure,world war ii,fighter pilot,fighter plane
342,0,0,1,0,The Pacifier,http://movies.disney.com/the-pacifier,Disgraced Navy SEAL Shane Wolfe is handed a new assignment: Protect the five Plummer kids from enemies of their recently deceased father -- a government scientist whose top-secret experiment remains hidden in the kids' house.,35.4763,Canada,2005-03-04,113006880,95.0,English,5.8,842,Action,Comedy,Drama,bodybuilder,children,body guard
343,0,0,0,1,Walking Tall,,"A former U.S. soldier returns to his hometown to find it overrun by crime and corruption, which prompts him to clean house.",23.438398,United States of America,2004-04-02,57223890,86.0,English,6.0,381,Adventure,Drama,Action,casino,sheriff,home
344,0,0,1,0,Alvin and the Chipmunks,http://www.chipmunks.com,"A struggling songwriter named Dave Seville finds success when he comes across a trio of singing chipmunks: mischievous leader Alvin, brainy Simon, and chubby, impressionable Theodore.",47.336034,United States of America,2007-12-13,361366633,92.0,English,5.5,1177,Comedy,Music,Family,pop,pop star,record producer
345,0,0,1,0,Pocahontas,,"History comes gloriously to life in Disney's epic animated tale about love and adventure in the New World. Pocahontas is a Native American woman whose father has arranged for her to marry her village's best warrior. But a vision tells her change is coming, and soon she comes face to face with it in the form of Capt. John Smith.",47.845589,United States of America,1995-06-14,346079773,81.0,English,6.7,1457,Adventure,Animation,Drama,culture clash,settler,forbidden love
346,1,0,0,0,The Nutty Professor,,"Eddie Murphy stars as shy Dr. Sherman Klump, a kind, brilliant, 'calorifically challenged' genetic professor. When beautiful Carla Purty joins the university faculty, Sherman grows desperate to whittle his 400-pound frame down to size and win her heart. So, with one swig of his experimental fat-reducing serum, Sherman becomes 'Buddy Love', a fast-talking, pumped-up , plumped down Don Juan.",20.28119,United States of America,1996-06-26,128769345,95.0,English,5.4,702,Fantasy,Comedy,Romance,overweight,overweight man,duringcreditsstinger
347,1,0,0,0,Hitch,,"Dating coach Alex 'Hitch' Hitchens mentors a bumbling client, Albert, who hopes to win the heart of the glamorous Allegra Cole. While Albert makes progress, Hitch faces his own romantic setbacks when proven techniques fail to work on Sara Melas, a tabloid reporter digging for dirt on Allegra Cole's love life. When Sara discovers Hitch's connection to Albert – now Allegra's boyfriend – it threatens to destroy both relationships.",34.576913,United States of America,2005-02-10,368100420,118.0,English,6.4,1665,Comedy,Drama,Romance,speed date,romantic comedy,dating
348,0,0,1,0,George of the Jungle,,"Baby George got into a plane crash in a jungle, stayed alive and was adopted by a wise ape. Ursula Stanhope, US noble woman is saved from death on safari by grown-up George, and he takes her to jungle to live with him. He slowly learns a rules of human relationships, while Ursula's lover Lyle is looking for her and the one who took her. After they are found, Ursula takes George to the USA.",22.573237,United States of America,1997-07-15,0,92.0,English,5.4,496,Adventure,Comedy,Family,africa,san francisco,gorilla
349,0,1,0,0,Date Night,http://www.datenight-movie.com/,"Phil and Claire Foster fear that their mild-mannered relationship may be falling into a stale rut. During their weekly date night, their dinner reservation leads to their being mistaken for a couple of thieves – and now a number of unsavoury characters want Phil and Claire killed.",38.06168,United States of America,2010-04-08,152263880,97.0,עִבְרִית,5.9,1122,Comedy,,,date,corruption,taxi
350,0,0,0,1,Crimson Tide,,"On a US nuclear missile sub, a young first officer stages a mutiny to prevent his trigger happy captain from launching his missiles before confirming his orders to do so.",20.334629,United States of America,1995-05-12,157387195,116.0,English,7.0,498,Action,Thriller,Drama,submarine,mutiny,russia
351,1,0,0,0,The Pursuit of Happyness,http://www.sonypictures.com/homevideo/thepursuitofhappyness/,"The true story of Christopher Gardner, who invests heavily in a device known as a 'Bone Density Scanner', only to find himself struggle to sell the product as it's just marginally better than the current technology, and much more expensive. His wife leaves him,  he loses his house, bank account and credit cards and, now forced to live out in the streets with his young son,  he's desperate to find a steady job. He takes on a job as a stockbroker but, before he can receive pay, he needs to go through 6 months of training, and must sell his devices.",80.581367,United States of America,2006-12-14,307077295,117.0,English,7.7,2525,Drama,,,san francisco,single parent,homeless person
352,1,0,0,0,Disclosure,,"A computer specialist is sued for sexual harassment by a former lover turned boss who initiated the act forcefully, which threatens both his career and his personal life.",15.064058,United States of America,1994-12-09,214015089,123.0,English,5.9,210,Drama,Thriller,Crime,employee,workplace,sexual harassment
353,1,0,0,0,Kill Bill: Vol. 1,http://www.miramax.com/movie/kill-bill-volume-1/,"An assassin is shot at the altar by her ruthless employer, Bill and other members of their assassination circle – but 'The Bride' lives to plot her vengeance. Setting out for some payback, she makes a death list and hunts down those who wronged her, saving Bill for last.",79.754966,United States of America,2003-10-10,180949000,111.0,English,7.7,4949,Action,Crime,,japan,coma,martial arts
