mid,netflix,amazon_prime,disney_plus,hulu,original_title,homepage,overview,popularity,production_countries,release_date,revenue,runtime,spoken_languages,vote_average,vote_count,genres_1,genres_2,genres_3,keywords_1,keywords_2,keywords_3
0,0,0,1,0,Avatar,http://www.avatarmovie.com/,"In the 22nd century, a paraplegic Marine is dispatched to the moon Pandora on a unique mission, but becomes torn between following orders and protecting an alien civilization.",150.437577,United States of America,2009-12-10,2787965087,162.0,English,7.2,11800,Action,Adventure,Fantasy,culture clash,future,space war
1,0,0,1,0,Pirates of the Caribbean: At World's End,http://disney.go.com/disneypictures/pirates/,"Captain Barbossa, long believed to be dead, has come back to life and is headed to the edge of the Earth with Will Turner and Elizabeth Swann. But nothing is quite as it seems.",139.082615,United States of America,2007-05-19,961000000,169.0,English,6.9,4500,Adventure,Fantasy,Action,ocean,drug abuse,exotic island
2,1,0,1,0,John Carter,http://movies.disney.com/john-carter,"John Carter is a war-weary, former military captain who's inexplicably transported to the mysterious and exotic planet of Barsoom (Mars) and reluctantly becomes embroiled in an epic conflict. It's a world on the brink of collapse, and Carter rediscovers his humanity when he realizes the survival of Barsoom and its people rests in his hands.",43.926995,United States of America,2012-03-07,284139100,132.0,English,6.1,2124,Action,Adventure,Science Fiction,based on novel,mars,medallion
3,1,0,0,1,Spider-Man 3,http://www.sonypictures.com/movies/spider-man3/,"The seemingly invincible Spider-Man goes up against an all-new crop of villain – including the shape-shifting Sandman. While Spider-Man’s superpowers are altered by an alien organism, his alter ego, Peter Parker, deals with nemesis Eddie Brock and also gets caught up in a love triangle.",115.699814,United States of America,2007-05-01,890871626,139.0,English,5.9,3576,Fantasy,Action,Adventure,dual identity,amnesia,sandstorm
4,0,0,1,0,Tangled,http://disney.go.com/disneypictures/tangled/,"When the kingdom's most wanted-and most charming-bandit Flynn Rider hides out in a mysterious tower, he's taken hostage by Rapunzel, a beautiful and feisty tower-bound teen with 70 feet of magical, golden hair. Flynn's curious captor, who's looking for her ticket out of the tower where she's been locked away for years, strikes a deal with the handsome thief and the unlikely duo sets off on an action-packed escapade, complete with a super-cop horse, an over-protective chameleon and a gruff gang of pub thugs.",48.681969,United States of America,2010-11-24,591794936,100.0,English,7.4,3330,Animation,Family,,hostage,magic,horse
5,1,0,0,0,Superman Returns,http://www.superman.com,"Superman returns to discover his 5-year absence has allowed Lex Luthor to walk free, and that those he was closest too felt abandoned and have moved on. Luthor plots his ultimate revenge that could see millions killed and change the face of the planet forever, as well as ridding himself of the Man of Steel.",57.925623,United States of America,2006-06-28,391081192,154.0,English,5.4,1400,Adventure,Fantasy,Action,saving the world,dc comics,invulnerability
6,1,1,0,0,Quantum of Solace,http://www.mgm.com/view/movie/234/Quantum-of-Solace/,"Quantum of Solace continues the adventures of James Bond after Casino Royale. Betrayed by Vesper, the woman he loved, 007 fights the urge to make his latest mission personal. Pursuing his determination to uncover the truth, Bond and M interrogate Mr. White, who reveals that the organization that blackmailed Vesper is far more complex and dangerous than anyone had imagined.",107.928811,United Kingdom,2008-10-30,586090727,106.0,English,6.1,2965,Adventure,Action,Thriller,killing,undercover,secret agent
7,0,0,1,0,Pirates of the Caribbean: Dead Man's Chest,http://disney.go.com/disneypictures/pirates/,"Captain Jack Sparrow works his way out of a blood debt with the ghostly Davey Jones, he also attempts to avoid eternal damnation.",145.847379,Jamaica,2006-06-20,1065659812,151.0,English,7.0,5246,Adventure,Fantasy,Action,witch,fortune teller,bondage
8,0,0,1,0,The Chronicles of Narnia: Prince Caspian,,"One year after their incredible adventures in the Lion, the Witch and the Wardrobe, Peter, Edmund, Lucy and Susan Pevensie return to Narnia to aid a young prince whose life has been threatened by the evil King Miraz. Now, with the help of a colorful cast of new characters, including Trufflehunter the badger and Nikabrik the dwarf, the Pevensie clan embarks on an incredible quest to ensure that Narnia is returned to its rightful heir.",53.978602,Czech Republic,2008-05-15,419651413,150.0,English,6.3,1630,Adventure,Family,Fantasy,based on novel,fictional place,brother sister relationship
9,0,0,1,0,Pirates of the Caribbean: On Stranger Tides,http://disney.go.com/pirates/index-on-stranger-tides.html#/video/,"Captain Jack Sparrow crosses paths with a woman from his past, and he's not sure if it's love -- or if she's a ruthless con artist who's using him to find the fabled Fountain of Youth. When she forces him aboard the Queen Anne's Revenge, the ship of the formidable pirate Blackbeard, Jack finds himself on an unexpected adventure in which he doesn't know who to fear more: Blackbeard or the woman from his past.",135.413856,United States of America,2011-05-14,1045713802,136.0,English,6.4,4948,Adventure,Action,Fantasy,sea,captain,mutiny
10,0,0,1,0,Robin Hood,http://www.robinhoodthemovie.com/,"When soldier Robin happens upon the dying Robert of Loxley, he promises to return the man's sword to his family in Nottingham. There, he assumes Robert's identity; romances his widow, Marion; and draws the ire of the town's sheriff and King John's henchman, Godfrey.",37.668301,United Kingdom,2010-05-12,310669540,140.0,English,6.2,1398,Action,Adventure,,robin hood,archer,knight
11,0,0,0,1,Skyfall,http://www.skyfall-movie.com,"When Bond's latest assignment goes gravely wrong and agents around the world are exposed, MI6 is attacked forcing M to relocate the agency. These events cause her authority and position to be challenged by Gareth Mallory, the new Chairman of the Intelligence and Security Committee. With MI6 now compromised from both inside and out, M is left with one ally she can trust: Bond. 007 takes to the shadows - aided only by field agent, Eve - following a trail to the mysterious Silva, whose lethal and hidden motives have yet to reveal themselves.",93.004993,United Kingdom,2012-10-25,1108561013,143.0,English,6.9,7604,Action,Adventure,Thriller,spy,secret agent,sociopath
12,0,0,0,1,Spider-Man 2,http://www.sonypictures.com/movies/spider-man2/,"Peter Parker is going through a major identity crisis. Burned out from being Spider-Man, he decides to shelve his superhero alter ego, which leaves the city suffering in the wake of carnage left by the evil Doc Ock. In the meantime, Parker still can't act on his feelings for Mary Jane Watson, a girl he's loved since childhood.",35.149586,United States of America,2004-06-25,783766341,127.0,English,6.7,4321,Action,Adventure,Fantasy,dual identity,love of one's life,pizza boy
13,0,0,1,0,Alice in Wonderland,http://disney.go.com/wonderland/,"Alice, an unpretentious and individual 19-year-old, is betrothed to a dunce of an English nobleman. At her engagement party, she escapes the crowd to consider whether to go through with the marriage and falls down a hole in the garden after spotting an unusual rabbit. Arriving in a strange and surreal place called 'Underland,' she finds herself in a world that resembles the nightmares she had as a child, filled with talking animals, villainous queens and knights, and frumious bandersnatches. Alice realizes that she is there for a reason – to conquer the horrific Jabberwocky and restore the rightful queen to her throne.",78.530105,United States of America,2010-03-03,1025491110,108.0,English,6.4,4645,Family,Fantasy,Adventure,based on novel,fictional place,queen
14,0,0,1,0,X-Men: The Last Stand,,"When a cure is found to treat mutations, lines are drawn amongst the X-Men and The Brotherhood, a band of powerful mutants organized under Xavier's former ally, Magneto.",3.857526,Canada,2006-05-24,459359555,104.0,English,6.3,3525,Adventure,Action,Science Fiction,mutant,marvel comic,based on comic book
15,0,0,1,0,Monsters University,,A look at the relationship between Mike and Sulley during their days at Monsters University — when they weren't necessarily the best of friends.,89.186492,United States of America,2013-06-20,743559607,104.0,English,7.0,3528,Animation,Family,,monster,dormitory,games
16,0,0,1,0,Cars 2,http://www.disney.go.com/cars/,Star race car Lightning McQueen and his pal Mater head overseas to compete in the World Grand Prix race. But the road to the championship becomes rocky as Mater gets caught up in an intriguing adventure of his own: international espionage.,49.98659,United States of America,2011-06-11,559852396,106.0,English,5.8,2033,Animation,Family,Adventure,car race,sequel,comedy
17,1,0,0,0,Green Lantern,http://greenlanternmovie.warnerbros.com/,"For centuries, a small but powerful force of warriors called the Green Lantern Corps has sworn to keep intergalactic order. Each Green Lantern wears a ring that grants him superpowers. But when a new enemy called Parallax threatens to destroy the balance of power in the Universe, their fate and the fate of Earth lie in the hands of the first human ever recruited.",51.872839,United States of America,2011-06-16,219851172,114.0,English,5.1,2487,Adventure,Action,Thriller,dc comics,transformation,superhero
18,0,0,1,0,Toy Story 3,http://disney.go.com/toystory/,"Woody, Buzz, and the rest of Andy's toys haven't been played with in years. With Andy about to go to college, the gang find themselves accidentally left at a nefarious day care center. The toys must band together to escape and return home to Andy.",59.995418,United States of America,2010-06-16,1066969703,103.0,English,7.6,4597,Animation,Family,Comedy,hostage,college,toy
19,1,0,0,0,Terminator Salvation,https://www.warnerbros.com/terminator-salvation,"All grown up in post-apocalyptic 2018, John Connor must lead the resistance of humans against the increasingly dominating militaristic robots. But when Marcus Wright appears, his existence confuses the mission as Connor tries to determine whether Wright has come from the future or the past -- and whether he's friend or foe.",71.862892,Germany,2009-05-20,371353001,115.0,English,5.9,2463,Action,Science Fiction,Thriller,saving the world,artificial intelligence,prophecy
20,0,0,1,0,X-Men: Days of Future Past,http://www.x-menmovies.com/,The ultimate X-Men ensemble fights a war for the survival of the species across two time periods as they join forces with their younger selves in an epic battle that must change the past – to save our future.,118.078691,United Kingdom,2014-05-15,747862775,131.0,English,7.5,6032,Action,Adventure,Fantasy,1970s,mutant,time travel
21,0,0,1,0,Prince of Persia: The Sands of Time,http://disney.go.com/disneypictures/princeofpersia,"A rogue prince reluctantly joins forces with a mysterious princess and together, they race against dark forces to safeguard an ancient dagger capable of releasing the Sands of Time – gift from the gods that can reverse time and allow its possessor to rule the world.",62.169881,United States of America,2010-05-19,335154643,116.0,English,6.2,2317,Adventure,Fantasy,Action,persia,sandstorm,brother against brother
22,1,0,0,0,Indiana Jones and the Kingdom of the Crystal Skull,http://www.indianajones.com/site/index.html,"Set during the Cold War, the Soviets – led by sword-wielding Irina Spalko – are in search of a crystal skull which has supernatural powers related to a mystical Lost City of Gold. After being captured and then escaping from them, Indy is coerced to head to Peru at the behest of a young man whose friend – and Indy's colleague – Professor Oxley has been captured for his knowledge of the skull's whereabouts.",75.674458,United States of America,2008-05-21,786636033,122.0,English,5.7,2495,Adventure,Action,,saving the world,riddle,whip
23,0,0,1,0,The Good Dinosaur,http://movies.disney.com/the-good-dinosaur,An epic journey into the world of dinosaurs where an Apatosaurus named Arlo makes an unlikely human friend.,51.692953,United States of America,2015-11-14,331926147,93.0,English,6.6,1736,Adventure,Animation,Family,tyrannosaurus rex,friends,alternate history
24,0,0,1,0,Brave,http://disney.go.com/brave/#/home,"Brave is set in the mystical Scottish Highlands, where Mérida is the princess of a kingdom ruled by King Fergus and Queen Elinor. An unruly daughter and an accomplished archer, Mérida one day defies a sacred custom of the land and inadvertently brings turmoil to the kingdom. In an attempt to set things right, Mérida seeks out an eccentric old Wise Woman and is granted an ill-fated wish. Also figuring into Mérida’s quest — and serving as comic relief — are the kingdom’s three lords: the enormous Lord MacGuffin, the surly Lord Macintosh, and the disagreeable Lord Dingwall.",125.114374,United States of America,2012-06-21,538983207,93.0,English,6.7,4641,Animation,Adventure,Comedy,scotland,rebel,bravery
25,0,0,0,1,Star Trek Beyond,http://www.startrekmovie.com/,"The USS Enterprise crew explores the furthest reaches of uncharted space, where they encounter a mysterious new enemy who puts them and everything the Federation stands for to the test.",65.352913,United States of America,2016-07-07,343471816,122.0,English,6.6,2568,Action,Adventure,Science Fiction,sequel,stranded,hatred
26,1,0,0,0,2012,http://www.sonypictures.com/movies/2012,"Dr. Adrian Helmsley, part of a worldwide geophysical team investigating the effect on the earth of radiation from unprecedented solar storms, learns that the earth's core is heating up. He warns U.S. President Thomas Wilson that the crust of the earth is becoming unstable and that without proper preparations for saving a fraction of the world's population, the entire race is doomed. Meanwhile, writer Jackson Curtis stumbles on the same information. While the world's leaders race to build ""arks"" to escape the impending cataclysm, Curtis struggles to find a way to save his family. Meanwhile, volcanic eruptions and earthquakes of unprecedented strength wreak havoc around the world.",45.274225,Canada,2009-10-10,769653595,158.0,English,5.6,4903,Action,Adventure,Science Fiction,civilization,natural disaster,end of the world
27,1,0,0,0,Jupiter Ascending,http://www.jupiterascending.com,"In a universe where human genetic material is the most precious commodity, an impoverished young Earth woman becomes the key to strategic maneuvers and internal strife within a powerful dynasty…",85.36908,United States of America,2015-02-04,183987723,124.0,English,5.2,2768,Science Fiction,Fantasy,Action,jupiter,space,woman director
28,0,0,1,0,"The Chronicles of Narnia: The Lion, the Witch and the Wardrobe",,"Siblings Lucy, Edmund, Susan and Peter step through a magical wardrobe and find the land of Narnia. There, the they discover a charming, once peaceful kingdom that has been plunged into eternal winter by the evil White Witch, Jadis. Aided by the wise and magnificent lion, Aslan, the children lead Narnia into a spectacular, climactic battle to be free of the Witch's glacial powers forever.",67.391328,United Kingdom,2005-12-07,748806957,143.0,English,6.7,2629,Adventure,Family,Fantasy,saving the world,witch,based on novel
29,0,0,1,0,X-Men: Apocalypse,http://www.foxmovies.com/movies/x-men-apocalypse,"After the re-emergence of the world's first mutant, world-destroyer Apocalypse, the X-Men must unite to defeat his extinction level plan.",139.272042,United States of America,2016-05-18,543934787,144.0,English,6.4,4721,Science Fiction,,,mutant,supernatural powers,marvel comic
30,0,0,1,0,Up,http://disney.go.com/disneypictures/up/,"Carl Fredricksen spent his entire life dreaming of exploring the globe and experiencing life to its fullest. But at age 78, life seems to have passed him by, until a twist of fate (and a persistent 8-year old Wilderness Explorer named Russell) gives him a new lease on life.",92.201962,United States of America,2009-05-13,735099082,96.0,English,7.7,6870,Animation,Comedy,Family,age difference,central and south america,balloon
31,1,0,0,0,Hugo,http://www.hugomovie.com/,"Hugo is an orphan boy living in the walls of a train station in 1930s Paris. He learned to fix clocks and other gadgets from his father and uncle which he puts to use keeping the train station clocks running. The only thing that he has left that connects him to his dead father is an automaton (mechanical man) that doesn't work without a special key which Hugo needs to find to unlock the secret he believes it contains. On his adventures, he meets with a shopkeeper, George Melies, who works in the train station and his adventure-seeking god-daughter. Hugo finds that they have a surprising connection to his father and the automaton, and he discovers it unlocks some memories the old man has buried inside regarding his past.",32.319043,France,2011-11-22,185770160,126.0,English,7.0,2141,Adventure,Drama,Family,library,clock,film director
32,1,0,0,0,Wild Wild West,,Legless Southern inventor Dr. Arliss Loveless plans to rekindle the Civil War by assassinating President U.S. Grant. Only two men can stop him: gunfighter James West and master-of-disguise and inventor Artemus Gordon. The two must team up to thwart Loveless' plans.,40.748915,United States of America,1999-06-29,222104681,106.0,English,5.1,1020,Action,Adventure,Comedy,steampunk,based on tv series,steam locomotive
33,1,1,0,0,Evan Almighty,http://www.evanalmighty.com/,God contacts Congressman Evan Baxter and tells him to build an ark in preparation for a great flood.,27.082182,United States of America,2007-06-09,173000000,96.0,English,5.3,1151,Fantasy,Comedy,Family,father son relationship,daily life,married couple
34,0,1,1,0,Inside Out,http://movies.disney.com/inside-out,"Growing up can be a bumpy road, and it's no exception for Riley, who is uprooted from her Midwest life when her father starts a new job in San Francisco. Like all of us, Riley is guided by her emotions - Joy, Fear, Anger, Disgust and Sadness. The emotions live in Headquarters, the control center inside Riley's mind, where they help advise her through everyday life. As Riley and her emotions struggle to adjust to a new life in San Francisco, turmoil ensues in Headquarters. Although Joy, Riley's main and most important emotion, tries to keep things positive, the emotions conflict on how best to navigate a new city, house and school.",128.655964,United States of America,2015-06-09,857611174,94.0,English,8.0,6560,Drama,Comedy,Animation,dream,cartoon,imaginary friend
35,0,0,1,0,The Jungle Book,http://movies.disney.com/the-jungle-book-2016,"After a threat from the tiger Shere Khan forces him to flee the jungle, a man-cub named Mowgli embarks on a journey of self discovery with the help of panther, Bagheera, and free spirited bear, Baloo.",94.199316,United Kingdom,2016-04-07,966550600,106.0,English,6.7,2892,Family,Adventure,Drama,based on novel,snake,wolf
36,0,0,1,0,Maleficent,http://movies.disney.com/maleficent,"The untold story of Disney's most iconic villain from the 1959 classic 'Sleeping Beauty'. A beautiful, pure-hearted young woman, Maleficent has an idyllic life growing up in a peaceable forest kingdom, until one day when an invading army threatens the harmony of the land.  Maleficent rises to be the land's fiercest protector, but she ultimately suffers a ruthless betrayal – an act that begins to turn her heart into stone. Bent on revenge, Maleficent faces an epic battle with the invading King's successor and, as a result, places a curse upon his newborn infant Aurora. As the child grows, Maleficent realizes that Aurora holds the key to peace in the kingdom - and to Maleficent's true happiness as well.",110.620647,United States of America,2014-05-28,758539785,97.0,English,7.0,4496,Fantasy,Adventure,Action,fairy tale,villain,sleeping beauty
37,1,0,0,0,The Lovers,,"The Lovers is an epic romance time travel adventure film. Helmed by Roland Joffé from a story by Ajey Jhankar, the film is a sweeping tale of an impossible love set against the backdrop of the first Anglo-Maratha war across two time periods and continents and centred around four characters — a British officer in 18th century colonial India, the Indian woman he falls deeply in love with, an American present-day marine biologist and his wife.",2.418535,Australia,2015-02-13,0,109.0,English,4.8,34,Action,Adventure,Science Fiction,,,
38,0,0,1,0,Tomorrowland,http://movies.disney.com/tomorrowland,"Bound by a shared destiny, a bright, optimistic teen bursting with scientific curiosity and a former boy-genius inventor jaded by disillusionment embark on a danger-filled mission to unearth the secrets of an enigmatic place somewhere in time and space that exists in their collective memory as ""Tomorrowland.""",130.311355,United States of America,2015-05-19,209154322,130.0,English,6.2,2846,Adventure,Family,Mystery,inventor,apocalypse,destiny
39,0,0,1,0,Big Hero 6,http://movies.disney.com/big-hero-6,"The special bond that develops between plus-sized inflatable robot Baymax, and prodigy Hiro Hamada, who team up with a group of friends to form a band of high-tech heroes.",203.73459,United States of America,2014-10-24,652105443,102.0,English,7.8,6135,Adventure,Family,Animation,brother brother relationship,hero,talent
40,0,0,1,0,Wreck-It Ralph,http://disney.go.com/wreck-it-ralph,"Wreck-It Ralph is the 9-foot-tall, 643-pound villain of an arcade video game named Fix-It Felix Jr., in which the game's titular hero fixes buildings that Ralph destroys. Wanting to prove he can be a good guy and not just a villain, Ralph escapes his game and lands in Hero's Duty, a first-person shooter where he helps the game's hero battle against alien invaders. He later enters Sugar Rush, a kart racing game set on tracks made of candies, cookies and other sweets. There, Ralph meets Vanellope von Schweetz who has learned that her game is faced with a dire threat that could affect the entire arcade, and one that Ralph may have inadvertently started.",62.341073,United States of America,2012-11-01,471222889,108.0,English,7.1,4570,Family,Animation,Comedy,support group,product placement,bullying
41,1,0,0,0,The Polar Express,,"When a doubting young boy takes an extraordinary train ride to the North Pole, he embarks on a journey of self-discovery that shows him that the wonder of life never fades for those who believe.",47.323228,United States of America,2004-11-10,305875730,100.0,English,6.4,1474,Adventure,Animation,Family,santa claus,nerd,faith
42,1,0,0,0,Terminator 3: Rise of the Machines,,"It's been 10 years since John Connor saved Earth from Judgment Day, and he's now living under the radar, steering clear of using anything Skynet can trace. That is, until he encounters T-X, a robotic assassin ordered to finish what T-1000 started. Good thing Connor's former nemesis, the Terminator, is back to aid the now-adult Connor … just like he promised.",69.405188,Germany,2003-07-02,435000000,109.0,English,5.9,2143,Action,Thriller,Science Fiction,saving the world,artificial intelligence,man vs machine
43,1,0,0,0,Inception,http://inceptionmovie.warnerbros.com/,"Cobb, a skilled thief who commits corporate espionage by infiltrating the subconscious of his targets is offered a chance to regain his old life as payment for a task considered to be impossible: ""inception"", the implantation of another person's idea into a target's subconscious.",167.58371,United Kingdom,2010-07-14,825532764,148.0,English,8.1,13752,Action,Thriller,Science Fiction,loss of lover,dream,kidnapping
44,0,0,1,0,X-Men: First Class,http://www.x-menfirstclassmovie.com/,"Before Charles Xavier and Erik Lensherr took the names Professor X and Magneto, they were two young men discovering their powers for the first time. Before they were arch-enemies, they were closest of friends, working together with other mutants (some familiar, some new), to stop the greatest threat the world has ever known.",3.195174,United States of America,2011-05-24,353624124,132.0,Deutsch,7.1,5181,Action,Science Fiction,Adventure,cia,mutant,mine
45,0,0,1,0,The Sorcerer's Apprentice,http://disney.go.com/disneypictures/sorcerersapprentice/,"Balthazar Blake is a master sorcerer in modern-day Manhattan trying to defend the city from his arch-nemesis, Maxim Horvath. Balthazar can't do it alone, so he recruits Dave Stutler, a seemingly average guy who demonstrates hidden potential, as his reluctant protégé. The sorcerer gives his unwilling accomplice a crash course in the art and science of magic, and together, these unlikely partners work to stop the forces of darkness.",35.580815,United States of America,2010-07-13,215283742,109.0,English,5.8,1470,Fantasy,Adventure,Action,witch,fire,wolf
46,1,0,0,0,Poseidon,http://www2.warnerbros.com/poseidon/,"A packed cruise ship traveling the Atlantic is hit and overturned by a massive wave, compelling the passengers to begin a dramatic fight for their lives.",21.133748,United States of America,2006-05-12,181674817,99.0,English,5.5,583,Adventure,Action,Drama,new year's eve,fire,drowning
47,0,0,1,0,Alice Through the Looking Glass,http://movies.disney.com/alice-through-the-looking-glass,"In the sequel to Tim Burton's ""Alice in Wonderland"", Alice Kingsleigh returns to Underland and faces a new adventure in saving the Mad Hatter.",56.268916,United Kingdom,2016-05-25,299370084,113.0,English,6.5,1725,Fantasy,,,based on novel,clock,queen
