mid,netflix,amazon_prime,disney_plus,hulu,original_title,homepage,overview,popularity,production_countries,release_date,revenue,runtime,spoken_languages,vote_average,vote_count,genres_1,genres_2,genres_3,keywords_1,keywords_2,keywords_3
906,0,1,0,1,I Love You Phillip Morris,,"Steve Russell is a small-town cop. Bored with his bland lifestyle, Russell turns to fraud as a means of shaking things up. Before long, Russell's criminal antics have landed him behind bars, where he encounters the charismatic Phillip Morris. Smitten, Russell devotes his entire life to being with Morris regardless of the consequences.",19.664699,United States of America,2009-01-18,10652035,98.0,English,6.4,503,Comedy,Drama,Romance,judge,small town,con man
907,0,1,0,0,Sorority Row,,"When five sorority girls inadvertently cause the murder of one of their sisters in a prank gone wrong, they agree to keep the matter to themselves and never speak of it again, so they can get on with their lives. This proves easier said than done, when after graduation a mysterious killer goes after the five of them and anyone who knows their secret.",8.780512,United States of America,2009-09-09,27206120,101.0,English,5.4,177,Horror,Mystery,Thriller,female nudity,graduation,serial killer
908,0,1,0,0,Machete,http://www.vivamachete.com/,"After being set-up and betrayed by the man who hired him to assassinate a Texas Senator, an ex-Federale launches a brutal rampage of revenge against his former boss.",26.396191,United States of America,2010-09-01,31327899,105.0,English,6.3,1150,Action,Comedy,Thriller,illegal immigration,immigration law,machete
909,0,1,0,0,The Perfect Game,http://www.theperfectgamemovie.com,"Based on a true story, a group of boys from Monterrey, Mexico who become the first non-U.S. team to win the Little League World Series.",0.903529,United States of America,2010-04-01,3878993,118.0,English,6.3,30,Drama,Family,,baseball,sport,based on true story
910,1,0,0,0,Jaws,http://www.jaws25.com/,"An insatiable great white shark terrorizes the townspeople of Amity Island, The police chief, an oceanographer and a grizzled shark hunter seek to destroy the bloodthirsty beast.",50.152327,United States of America,1975-06-18,470654000,124.0,English,7.5,2542,Horror,Thriller,Adventure,fishing,atlantic ocean,bathing
911,1,1,0,0,The Golden Child,,"A detective specializing in missing children is on a madcap mission to save a youth with mystical powers who's been abducted by an evil cult. He battles a band of super-nasties, scrambles through a booby-trapped chamber of horrors and traverses Tibet to obtain a sacred dagger.",15.26213,United States of America,1986-12-12,79817939,94.0,Český,5.6,304,Action,Adventure,Comedy,monk,social worker,wretch
912,0,0,0,1,Star Trek II: The Wrath of Khan,,Admiral James T. Kirk is feeling old; the prospect of accompanying his old ship the Enterprise on a two week cadet cruise is not making him feel any younger. But the training cruise becomes a a life or death struggle when Khan escapes from years of exile and captures the power of creation itself.,22.434102,United States of America,1982-06-03,96800000,113.0,English,7.3,675,Action,Adventure,Science Fiction,uss enterprise,genesis,asteroid
913,1,0,0,0,Act of Valor,http://www.actofvalor.com/,"When a covert mission to rescue a kidnapped CIA operative uncovers a chilling plot, an elite, highly trained U.S. SEAL team speeds to hotspots around the globe, racing against the clock to stop a deadly terrorist attack.",21.958055,United States of America,2012-02-24,81272766,110.0,English,6.3,417,Action,Thriller,War,submarine,navy,scuba diving
914,1,0,0,0,Jackie Brown,,"Jackie Brown is a flight attendant who gets caught in the middle of smuggling cash into the country for her gunrunner boss. When the cops try to use Jackie to get to her boss, she hatches a plan—with help from a bail bondsman—to keep the money for herself. Based on Elmore Leonard's novel “Rum Punch”.",40.631671,United States of America,1997-12-24,39673162,154.0,English,7.3,1514,Comedy,Crime,Romance,airport,underworld,arms deal
915,1,0,0,0,Harold & Kumar Escape from Guantanamo Bay,http://www.haroldandkumar.com,"Having satisfied their urge for White Castle, Harold and Kumar jump on a plane to catch up with Harold's love interest, who's headed for the Netherlands. But the pair must change their plans when Kumar is accused of being a terrorist. Rob Corddry also stars in this wild comedy sequel that follows the hapless stoners' misadventures as they try to avoid being captured by the Department of Homeland Security.",26.219598,United States of America,2008-04-25,43493123,107.0,English,6.2,497,Comedy,Adventure,,terrorist,aftercreditsstinger,duringcreditsstinger
916,0,1,0,0,Crossroads,,"Three friends get together and bury a box making a pact to open it at midnight at their high school graduation. In the little town in Georgia that they live in, things soon change. One is little miss perfect, one is an engaged prom queen, and the other is a pregnant outcast. The night of graduation, they open the box and they strike up a conversation. All of a sudden, one brings up the topic of her going to Los Angeles for a record contract audition. They all decide to go together and they leave. With a little money, they set out on the road with a guy named Ben. When one of them tells the other a rumor that he might be a homicidal maniac they are all scared of him. When they reach LA, Lucy falls in love with Ben and against her father's wishes, she stays and she goes to the audition.",6.703319,United States of America,2002-02-15,61141030,93.0,English,4.7,158,Action,Adventure,Comedy,dancing,women,sex
917,0,0,1,0,The Muppet Christmas Carol,,"A retelling of the classic Dickens tale of Ebenezer Scrooge, miser extraordinaire. He is held accountable for his dastardly ways during night-time visitations by the Ghosts of Christmas Past, Present, and future.",15.085981,United States of America,1992-12-10,27281507,85.0,English,7.2,212,Comedy,Family,Fantasy,holiday,future,musical
918,0,0,1,0,The Fault in Our Stars,,"Despite the tumor-shrinking medical miracle that has bought her a few years, Hazel has never been anything but terminal, her final chapter inscribed upon diagnosis. But when a patient named Augustus Waters suddenly appears at Cancer Kid Support Group, Hazel's story is about to be completely rewritten.",74.358971,United States of America,2014-05-16,307166834,125.0,English,7.6,3759,Romance,Drama,,amsterdam,based on novel,support group
919,1,0,0,0,Rounders,,A young man is a reformed gambler who must return to playing big stakes poker to help a friend pay off loan sharks.,18.422008,United States of America,1998-09-11,22921898,121.0,Pусский,6.9,439,Drama,Crime,,gambling,law,compulsive gambling
920,0,1,0,0,Top Five,http://www.topfivemovie.com/,A comedian tries to make it as a serious actor when his reality-TV star fiancé talks him into broadcasting their wedding on her TV show.,15.896312,United States of America,2014-12-12,25434291,102.0,English,6.3,210,Drama,Comedy,,comedian,interview,reporter
921,1,0,0,0,Philomena,,"A woman searches for her adult son, who was taken away from her decades ago when she was forced to live in a convent.",29.019504,United Kingdom,2013-11-01,100129872,98.0,English,7.4,579,Drama,,,mother,washington d.c.,journalist
922,0,0,1,0,Aquamarine,http://www.aquamarinemovie.com/,"Two teenage girls discover that mermaids really do exist after a violent storm washes one ashore. The mermaid, a sassy creature named Aquamarine, is determined to prove to her father that real love exists, and enlists the girls' help in winning the heart of a handsome lifeguard.",16.931846,Australia,2006-03-03,23006849,104.0,English,5.8,364,Fantasy,Romance,Family,female friendship,mermaid,teenager
923,0,0,1,0,Max Keeble's Big Move,,"Max Keeble, the victim of his 7th grade class, plots revenge when he learns he's moving; it backfires when he doesn't move after all.",1.081822,United States of America,2001-10-05,17292381,86.0,English,5.4,33,Comedy,Family,Fantasy,,,
924,1,0,0,1,Young Adult,http://www.youngadultmovie.com/,"A divorced writer from the Midwest returns to her hometown to reconnect with an old flame, who's now married with a family.",16.183746,United States of America,2011-12-16,22939027,94.0,English,5.6,364,Comedy,Drama,,jealousy,dark comedy,writer
925,1,0,0,0,How to Be a Player,,"Dray is a young playboy whose only objective in life seems to be to have sex with as many girls as he can without getting caught by his girlfriend Lisa. Dray's sister Jenny and her friend Katrina plan to show him that the way he lives is wrong and organize a party in Malibu, inviting all of his girlfriends.",1.20245,United States of America,1997-08-06,13960203,93.0,English,5.3,8,Comedy,Romance,,sex,party,friends
926,1,0,0,0,Rachel Getting Married,,A young woman who has been in and out from rehab for the past 10 years returns home for the weekend for her sister's wedding.,14.345428,United States of America,2008-10-03,0,113.0,English,6.1,163,Drama,,,sister,independent film,maid of honor
927,0,0,0,1,Das Boot,http://www.dasboot.com,"A German submarine hunts allied ships during the Second World War, but it soon becomes the hunted. The crew tries to survive below the surface, while stretching both the boat and themselves to their limits.",26.967494,Germany,1981-09-16,85000000,149.0,Deutsch,7.9,613,Action,Drama,History,terror,submarine,based on novel
928,1,0,0,0,About Time,,"The night after another unsatisfactory New Year party, Tim's father tells his son that the men in his family have always had the ability to travel through time. Tim can't change history, but he can change what happens and has happened in his own life – so he decides to make his world a better place... by getting a girlfriend. Sadly, that turns out not to be as easy as he thinks.",74.817641,United Kingdom,2013-08-16,87100449,123.0,English,7.8,2067,Comedy,Drama,Science Fiction,london england,father son relationship,time travel
929,1,0,0,0,In the Cut,,"Following the gruesome murder of a young woman in her neighborhood, a self-determined woman living in New York City--as if to test the limits of her own safety--propels herself into an impossibly risky sexual liaison. Soon she grows increasingly wary about the motives of every man with whom she has contact--and about her own.",10.536092,Australia,2003-09-09,23,119.0,English,4.6,89,Mystery,Thriller,,eroticism,suspense,woman director
930,1,0,0,0,Ravenous,,"Upon receiving reports of missing persons at Fort Spencer, a remote Army outpost on the Western frontier, Capt. John Boyd investigates. After arriving at his new post, Boyd and his regiment aid a wounded frontiersman who recounts a horrifying tale of a wagon train murdered by its supposed guide -- a vicious U.S. Army colonel gone rogue. Fearing the worst, the regiment heads out into the wilderness to verify the gruesome claims",9.164386,Czech Republic,1999-03-16,0,100.0,English,6.9,141,Comedy,Horror,Thriller,winter,cliff,cooking
931,0,1,0,0,The Dangerous Lives of Altar Boys,,"A group of Catholic school friends, after being caught drawing an obscene comic book, plan a heist that will outdo their previous prank and make them local legends.",2.24888,United States of America,2002-06-14,0,104.0,English,6.4,53,Comedy,Drama,,independent film,,
932,1,0,0,0,Brother,http://www.office-kitano.co.jp/brother/index.html,"A Japanese Yakuza gangster’s deadly existence in his homeland gets him exiled to Los Angeles, California, where he is taken in by his little brother and his brother’s gang. This is the first English film by Takeshi Kitano.",5.327714,United Kingdom,2000-09-09,15250000,114.0,English,6.8,107,Crime,Drama,Thriller,brother brother relationship,assassination,culture clash
933,0,1,0,0,Critical Care,,"Werner Ernst is a young hospital resident who becomes embroiled in a legal battle between two half-sisters who are fighting over the care of their comatose father. But are they really fighting over their father's care, or over his $10 million estate? Meanwhile, Werner must contend with his nutty supervisor, who insists that he only care for patients with full insurance. Can Werner sidestep the hospital's legal team and do what's best for the patient?",2.678715,United States of America,1997-10-31,0,107.0,English,6.1,9,Comedy,Drama,,nun,satire,hospital
934,0,0,0,1,Snatch,,"The second film from British director Guy Ritchie. Snatch tells an obscure story similar to his first fast-paced crazy character-colliding filled film “Lock, Stock and Two Smoking Barrels.” There are two overlapping stories here – one is the search for a stolen diamond, and the other about a boxing promoter who’s having trouble with a psychotic gangster.",53.595686,United Kingdom,2000-09-01,83557872,103.0,English,7.7,2912,Thriller,Crime,,gypsy,bare knuckle boxing,slang
935,1,0,0,0,Doctor Zhivago,,Doctor Zhivago is the filmed adapation of the Russian novel by Boris Pasternak from director David Lean that was an international success and today deemed a classic. Omar Sharif and Julie Christie play two protagonists who in fact love each other yet because of their current situation cannot find a way be together.,12.854853,Italy,1965-12-22,111858363,197.0,English,7.4,247,Drama,Romance,War,love triangle,nurse,suicide attempt
936,1,0,0,0,Trash,,"Set in Brazil, three kids who make a discovery in a garbage dump soon find themselves running from the cops and trying to right a terrible wrong.",14.637357,Brazil,2014-10-09,0,112.0,English,7.1,242,Adventure,Crime,Drama,brazilian,drama,thriller
937,0,0,1,0,High School Musical 3: Senior Year,http://disney.go.com/disneypictures/highschoolmusical3,"It's almost graduation day for high school seniors Troy, Gabriella, Sharpay, Chad, Ryan and Taylor ― and the thought of heading off in separate directions after leaving East High has these Wildcats thinking they need to do something they'll remember forever. Together with the rest of the Wildcats, they stage a spring musical reflecting their hopes and fears about the future and their unforgettable experiences growing up together. But with graduation approaching and college plans in question, what will become of the dreams, romances, and friendships of East High's senior Wildcats?",21.801188,United States of America,2008-10-22,0,116.0,English,6.2,821,Comedy,Drama,Family,musical,music,high school
938,1,0,0,0,The Fighter,http://www.thefightermovie.com,"The Fighter, is a drama about boxer ""Irish"" Micky Ward's unlikely road to the world light welterweight title. His Rocky-like rise was shepherded by half-brother Dicky, a boxer-turned-trainer who rebounded in life after nearly being KO'd by drugs and crime.",31.019381,United States of America,2010-12-17,93617009,116.0,English,7.2,1486,Drama,,,sport,irish american,documentary crew
939,1,0,0,0,A Walk to Remember,http://www2.warnerbros.com/walktoremember/main.html,"When the popular, restless Landon Carter is forced to participate in the school drama production he falls in love with Jamie Sullivan, the daughter of the town's minister. Jamie has a ""to-do"" list for her life and also a very big secret she must keep from Landon.",33.283554,United States of America,2002-01-25,41227069,101.0,English,7.5,1018,Drama,Romance,,based on novel,theatre group,north carolina
940,0,1,0,0,The Ladies Man,,"Because of his salacious language, late-night radio advice-show host Leon Phelps, along with his sweet and loyal producer Julie, is fired from his Chicago gig. Leon gets a letter from a former lover promising a life of wealth, but he doesn't know who she is. Can Leon find his secret sugar-mama? What about Julie?",2.259537,United States of America,2000-10-13,13700000,84.0,English,5.7,34,Comedy,,,female nudity,tattoo,radio
941,1,0,0,0,Quartet,,"The directorial debut of Dustin Hoffman, Quartet is a high-drama comedy about temperamental divas and old grudges, passion and pride, romance and Rigoletto. At a home for retired musicians, the annual concert to celebrate Verdi's birthday is disrupted by the arrival of Jean, an eternal diva and former wife of one of the residents. Expect poignancy and plenty of laughs.",7.722021,United Kingdom,2012-09-08,59520298,98.0,English,6.3,139,Drama,Comedy,Romance,musician,concert,retired
942,0,1,0,0,Frailty,,"A man confesses to an FBI agent his family's story of how his religious fanatic father's visions lead to a series of murders to destroy supposed ""demons.""",16.003958,Germany,2001-11-17,13110448,100.0,English,7.0,334,Drama,Thriller,Crime,angel,sheriff,loss of mother
943,0,1,0,0,Slackers,,"Dave, Sam and Jeff are about to graduate from Holden University with honors in lying, cheating and scheming. The three roommates have proudly scammed their way through the last four years of college and now, during final exams, these big-men-on-campus are about to be busted by the most unlikely dude in school. Self-dubbed Cool Ethan, an ambitious nerd with a bad crush, enters their lives one day and everything begins to unravel.",9.371811,Canada,2002-02-01,6413915,86.0,English,5.4,60,Comedy,Romance,,male nudity,drug abuse,job interview
944,1,0,0,0,What's Eating Gilbert Grape,,"Gilbert has to care for his brother Arnie and his obese mother, which gets in the way when love walks into his life.",33.282794,United States of America,1993-12-17,30000000,118.0,English,7.5,919,Romance,Drama,,brother brother relationship,mentally disabled,iowa
945,0,1,0,0,Inside Llewyn Davis,http://www.cbsfilms.com/inside-llewyn-davis/,"In Greenwich Village in the early 1960s, gifted but volatile folk musician Llewyn Davis struggles with money, relationships, and his uncertain future following the suicide of his singing partner.",36.319205,United States of America,2013-10-06,32935319,105.0,English,7.2,834,Drama,Music,,folk music,performance,aspiring singer
946,0,1,0,0,LOL,,"In a world connected by YouTube, iTunes, and Facebook, Lola and her friends navigate the peer pressures of high school romance and friendship while dodging their sometimes overbearing and confused parents. When Lola's mom, Anne, ""accidentally"" reads her teenage daughter's racy journal, she realizes just how wide their communication gap has grown.",31.763201,United States of America,2012-02-10,0,97.0,English,5.9,881,Drama,Comedy,Romance,coming of age,mother daughter relationship,teen movie
947,0,1,0,0,The Last Days on Mars,,"On the last day of the first manned mission to Mars, a crew member of Tantalus Base believes he has made an astounding discovery – fossilized evidence of bacterial life. Unwilling to let the relief crew claims all the glory, he disobeys orders to pack up and goes out on an unauthorized expedition to collect further samples. But a routine excavation turns to disaster when the porous ground collapses and he falls into a deep crevice and near certain death. His devastated colleagues attempt to recover his body. However, when another vanishes, they start to suspect that the life-form they have discovered is not without danger.",18.764453,Ireland,2013-08-11,0,98.0,English,5.2,302,Science Fiction,Thriller,Horror,mars,science fiction,zombie
948,0,0,0,1,Good Will Hunting,http://www.miramax.com/movie/good-will-hunting,"Will Hunting has a genius-level IQ but chooses to work as a janitor at MIT. When he solves a difficult graduate-level math problem, his talents are discovered by Professor Gerald Lambeau, who decides to help the misguided youth reach his potential. When Will is arrested for attacking a police officer, Professor Lambeau makes a deal to get leniency for him if he will get treatment from therapist Sean Maguire.",43.734886,Canada,1997-12-05,225933435,126.0,English,7.9,2811,Drama,,,baseball,boston,professor
949,1,0,0,0,Stripes,,"John Winger, an indolent sad sack in his 30s, impulsively joins the U.S. Army after losing his job, his girlfriend and his apartment.",10.892398,United States of America,1981-06-25,85300000,106.0,English,6.5,249,Action,Comedy,,date,ex-girlfriend,u.s. army
950,0,0,1,0,The Mighty Ducks,,"After reckless young lawyer Gordon Bombay gets arrested for drunk driving, he must coach a kids hockey team for his community service. Gordon has experience on the ice, but isn't eager to return to hockey, a point hit home by his tense dealings with his own former coach, Jack Reilly. The reluctant Gordon eventually grows to appreciate his team, which includes promising young Charlie Conway, and leads them to take on Reilly's tough players.",8.932837,United States of America,1992-10-01,50752337,101.0,English,6.4,198,Comedy,Family,,sports team,sport,ice hockey
951,0,1,0,0,The Best Exotic Marigold Hotel,http://www.foxsearchlight.com/thebestexoticmarigoldhotel/,"British retirees travel to India to take up residence in what they believe is a newly restored hotel. Less luxurious than its advertisements, the Marigold Hotel nevertheless slowly begins to charm in unexpected ways as the residents find new purpose in their old age.",21.258991,United Arab Emirates,2011-11-28,136836156,124.0,हिन्दी,6.9,459,Drama,Comedy,,hotel,based on novel,india
952,0,0,1,0,Recess: School's Out,,"Recess: School's Out is a 2001 animated film based on the Disney television series Recess. This film was produced by Walt Disney Pictures and was released theatrically nationwide on February 16, 2001.It's the most exciting time of year at Third Street Elementary-- the end of the School Year! But boredom quickly sets in for protagonist TJ Detweiler, as his friends are headed for Summer Camp. One day, while passing by the school on his bike, he notices a green glow coming from the school's auditorium. This is the work of the insidious ex-principal of Third Street, Phillium Benedict and his gang of ninjas and secret service look-alikes! Benedict is planning to get rid of Summer Vacation using his newly-acquired Tractor Beam, which he stole from the US Military Base in an effort to raise US Test Scores, and it's up to the Recess Gang to stop him! In the end.",5.699058,United States of America,2001-01-27,44460850,83.0,English,6.6,67,Science Fiction,Animation,Comedy,holiday,elementary school,friends
953,1,1,0,0,The Boy,http://theboymovie.tumblr.com/,"A nanny, working for a family whose son has just passed away, finds herself put in charge of caring for a lifelike doll that the couple treat as a real child.",38.179483,United States of America,2016-01-22,64188367,97.0,English,5.8,1102,Horror,Mystery,Thriller,suicide,england,fire
954,1,0,0,0,Employee of the Month,,"When he hears that the new female employee digs ambitious men who are the store employee of the month, a slacker gets his act together but finds himself in competition with his rival, an ambitious co-worker.",9.559737,United States of America,2006-10-06,38368909,103.0,English,5.3,153,Comedy,Romance,,salesclerk,midlife crisis,prenzlauer berg
955,1,0,0,0,Can't Hardly Wait,,"It's graduation day at Huntington Hills High, and you know what that means - time to party. And not just any party, either. This one will be a night to remember, as the nerds become studs, the jocks are humiliated, and freshman crushes blossom into grown-up romance.",11.350382,United States of America,1998-06-12,25605015,100.0,English,6.1,122,Comedy,Drama,Romance,alcohol,regret,homophobia
956,0,0,1,0,Pete's Dragon,http://movies.disney.com/petes-dragon-2016,"Pete is a mysterious 10-year-old with no family and no home who claims to live in the woods with a giant, green dragon named Elliott. With the help of Natalie, an 11-year-old girl whose father Jack owns the local lumber mill, forest ranger Grace sets out to determine where Pete came from, where he belongs, and the truth about this dragon.",31.974359,United States of America,2016-08-10,143695338,102.0,English,6.2,679,Adventure,Family,Fantasy,feral child,remake,dragon
957,1,0,0,0,Sinister 2,http://www.sinistermovie.com/,A young mother and her twin sons move into a rural house that's marked for death.,26.090495,United States of America,2015-08-19,52882018,97.0,English,5.4,581,Horror,,,haunted house,sequel,twins
958,1,0,0,0,Sparkle,,"Musical prodigy, Sparkle (Jordin Sparks) struggles to become a star while overcoming issues that are tearing her family apart. From an affluent Detroit area and daughter to a single mother (Whitney Houston), she tries to balance a new romance with music manager Stix (Derek Luke) while dealing with the unexpected challenges her new life will bring as she and her two sisters (Carmen Ejogo and Tika Sumpter) strive to become a dynamic singing group during the Motown-era.",2.698185,United States of America,2012-08-17,24637469,116.0,English,5.8,36,Drama,Music,,soong sisters,duringcreditsstinger,
959,0,1,0,0,Sugar Hill,http://en.wikipedia.org/wiki/Sugar_Hill_(1994_film),"Sugar Hill is a 1994 American crime-drama/neo-noir film starring Wesley Snipes and Michael Wright as brothers Roemello and Raynathan Skuggs. The film focuses on the two brothers, who are major drug dealers in the Harlem neighborhood of New York City.",2.580808,United States of America,1994-02-25,0,123.0,English,5.2,13,Drama,Action,Thriller,,,
960,0,0,0,1,Rushmore,,"When a beautiful first-grade teacher arrives at a prep school, she soon attracts the attention of an ambitious teenager named Max, who quickly falls in love with her. Max turns to the father of two of his schoolmates for advice on how to woo the teacher. However, the situation soon gets complicated when Max's new friend becomes involved with her, setting the two pals against one another in a war for her attention.",18.289303,United States of America,1998-09-17,17096053,93.0,Français,7.5,676,Comedy,Drama,,private school,lone wolf,theatre play
